ID,SystemCodeNumber,Capacity,Latitude,Longitude,Occupancy,VehicleType,TrafficConditionNearby,QueueLength,IsSpecialDay,LastUpdatedDate,LastUpdatedTime,DateTime,Date,Time,Hour,Minute,DayOfWeek,DayName,WeekOfYear,OccupancyRate,VehicleType_Encoded,TrafficLevel_Encoded
0,BHMBCCMKT01,577,26.14453614,91.73617216,61,car,low,1,0,04-10-2016,07:59:00,2016-10-04 07:59:00,2016-10-04,07:59:00,7,59,1,Tuesday,40,10.571923743500866,3,1
1,BHMBCCMKT01,577,26.14453614,91.73617216,64,car,low,1,0,04-10-2016,08:25:00,2016-10-04 08:25:00,2016-10-04,08:25:00,8,25,1,Tuesday,40,11.091854419410744,3,1
2,BHMBCCMKT01,577,26.14453614,91.73617216,80,car,low,2,0,04-10-2016,08:59:00,2016-10-04 08:59:00,2016-10-04,08:59:00,8,59,1,Tuesday,40,13.864818024263432,3,1
3,BHMBCCMKT01,577,26.14453614,91.73617216,107,car,low,2,0,04-10-2016,09:32:00,2016-10-04 09:32:00,2016-10-04,09:32:00,9,32,1,Tuesday,40,18.544194107452338,3,1
4,BHMBCCMKT01,577,26.14453614,91.73617216,150,bike,low,2,0,04-10-2016,09:59:00,2016-10-04 09:59:00,2016-10-04,09:59:00,9,59,1,Tuesday,40,25.99653379549394,2,1
5,BHMBCCMKT01,577,26.14453614,91.73617216,177,car,low,3,0,04-10-2016,10:26:00,2016-10-04 10:26:00,2016-10-04,10:26:00,10,26,1,Tuesday,40,30.675909878682845,3,1
6,BHMBCCMKT01,577,26.14453614,91.73617216,219,truck,high,6,0,04-10-2016,10:59:00,2016-10-04 10:59:00,2016-10-04,10:59:00,10,59,1,Tuesday,40,37.954939341421145,4,3
7,BHMBCCMKT01,577,26.14453614,91.73617216,247,car,average,5,0,04-10-2016,11:25:00,2016-10-04 11:25:00,2016-10-04,11:25:00,11,25,1,Tuesday,40,42.80762564991335,3,2
8,BHMBCCMKT01,577,26.14453614,91.73617216,259,cycle,average,5,0,04-10-2016,11:59:00,2016-10-04 11:59:00,2016-10-04,11:59:00,11,59,1,Tuesday,40,44.88734835355286,1,2
9,BHMBCCMKT01,577,26.14453614,91.73617216,266,bike,high,8,0,04-10-2016,12:29:00,2016-10-04 12:29:00,2016-10-04,12:29:00,12,29,1,Tuesday,40,46.10051993067591,2,3
10,BHMBCCMKT01,577,26.14453614,91.73617216,269,car,high,7,0,04-10-2016,13:02:00,2016-10-04 13:02:00,2016-10-04,13:02:00,13,2,1,Tuesday,40,46.62045060658579,3,3
11,BHMBCCMKT01,577,26.14453614,91.73617216,263,car,high,7,0,04-10-2016,13:29:00,2016-10-04 13:29:00,2016-10-04,13:29:00,13,29,1,Tuesday,40,45.58058925476603,3,3
12,BHMBCCMKT01,577,26.14453614,91.73617216,238,car,high,5,0,04-10-2016,14:02:00,2016-10-04 14:02:00,2016-10-04,14:02:00,14,2,1,Tuesday,40,41.24783362218371,3,3
13,BHMBCCMKT01,577,26.14453614,91.73617216,215,truck,average,3,0,04-10-2016,14:29:00,2016-10-04 14:29:00,2016-10-04,14:29:00,14,29,1,Tuesday,40,37.26169844020797,4,2
14,BHMBCCMKT01,577,26.14453614,91.73617216,192,bike,average,3,0,04-10-2016,14:57:00,2016-10-04 14:57:00,2016-10-04,14:57:00,14,57,1,Tuesday,40,33.27556325823224,2,2
15,BHMBCCMKT01,577,26.14453614,91.73617216,165,car,low,2,0,04-10-2016,15:30:00,2016-10-04 15:30:00,2016-10-04,15:30:00,15,30,1,Tuesday,40,28.596187175043326,3,1
16,BHMBCCMKT01,577,26.14453614,91.73617216,162,bike,low,1,0,04-10-2016,16:04:00,2016-10-04 16:04:00,2016-10-04,16:04:00,16,4,1,Tuesday,40,28.07625649913345,2,1
17,BHMBCCMKT01,577,26.14453614,91.73617216,143,car,average,2,0,04-10-2016,16:31:00,2016-10-04 16:31:00,2016-10-04,16:31:00,16,31,1,Tuesday,40,24.783362218370883,3,2
18,BHMBCCMKT01,577,26.14453614,91.73617216,54,car,low,1,0,05-10-2016,07:57:00,2016-10-05 07:57:00,2016-10-05,07:57:00,7,57,2,Wednesday,40,9.358752166377817,3,1
19,BHMBCCMKT01,577,26.14453614,91.73617216,59,car,average,1,0,05-10-2016,08:30:00,2016-10-05 08:30:00,2016-10-05,08:30:00,8,30,2,Wednesday,40,10.22530329289428,3,2
20,BHMBCCMKT01,577,26.14453614,91.73617216,71,car,low,2,0,05-10-2016,09:04:00,2016-10-05 09:04:00,2016-10-05,09:04:00,9,4,2,Wednesday,40,12.305025996533796,3,1
21,BHMBCCMKT01,577,26.14453614,91.73617216,83,car,average,2,0,05-10-2016,09:30:00,2016-10-05 09:30:00,2016-10-05,09:30:00,9,30,2,Wednesday,40,14.384748700173311,3,2
22,BHMBCCMKT01,577,26.14453614,91.73617216,114,car,low,3,0,05-10-2016,10:04:00,2016-10-05 10:04:00,2016-10-05,10:04:00,10,4,2,Wednesday,40,19.75736568457539,3,1
23,BHMBCCMKT01,577,26.14453614,91.73617216,128,truck,high,4,0,05-10-2016,10:30:00,2016-10-05 10:30:00,2016-10-05,10:30:00,10,30,2,Wednesday,40,22.183708838821488,4,3
24,BHMBCCMKT01,577,26.14453614,91.73617216,148,bike,average,4,0,05-10-2016,11:04:00,2016-10-05 11:04:00,2016-10-05,11:04:00,11,4,2,Wednesday,40,25.64991334488735,2,2
25,BHMBCCMKT01,577,26.14453614,91.73617216,162,car,average,4,0,05-10-2016,11:30:00,2016-10-05 11:30:00,2016-10-05,11:30:00,11,30,2,Wednesday,40,28.07625649913345,3,2
26,BHMBCCMKT01,577,26.14453614,91.73617216,178,car,high,6,0,05-10-2016,12:04:00,2016-10-05 12:04:00,2016-10-05,12:04:00,12,4,2,Wednesday,40,30.849220103986134,3,3
27,BHMBCCMKT01,577,26.14453614,91.73617216,183,car,high,7,0,05-10-2016,12:30:00,2016-10-05 12:30:00,2016-10-05,12:30:00,12,30,2,Wednesday,40,31.715771230502597,3,3
28,BHMBCCMKT01,577,26.14453614,91.73617216,175,car,high,7,0,05-10-2016,12:57:00,2016-10-05 12:57:00,2016-10-05,12:57:00,12,57,2,Wednesday,40,30.329289428076255,3,3
29,BHMBCCMKT01,577,26.14453614,91.73617216,179,truck,high,6,0,05-10-2016,13:30:00,2016-10-05 13:30:00,2016-10-05,13:30:00,13,30,2,Wednesday,40,31.022530329289427,4,3
30,BHMBCCMKT01,577,26.14453614,91.73617216,174,car,average,4,0,05-10-2016,13:57:00,2016-10-05 13:57:00,2016-10-05,13:57:00,13,57,2,Wednesday,40,30.155979202772965,3,2
31,BHMBCCMKT01,577,26.14453614,91.73617216,158,car,high,5,0,05-10-2016,14:30:00,2016-10-05 14:30:00,2016-10-05,14:30:00,14,30,2,Wednesday,40,27.38301559792028,3,3
32,BHMBCCMKT01,577,26.14453614,91.73617216,145,car,average,3,0,05-10-2016,14:57:00,2016-10-05 14:57:00,2016-10-05,14:57:00,14,57,2,Wednesday,40,25.12998266897747,3,2
33,BHMBCCMKT01,577,26.14453614,91.73617216,129,car,low,2,0,05-10-2016,15:30:00,2016-10-05 15:30:00,2016-10-05,15:30:00,15,30,2,Wednesday,40,22.357019064124785,3,1
34,BHMBCCMKT01,577,26.14453614,91.73617216,121,car,low,2,0,05-10-2016,16:04:00,2016-10-05 16:04:00,2016-10-05,16:04:00,16,4,2,Wednesday,40,20.97053726169844,3,1
35,BHMBCCMKT01,577,26.14453614,91.73617216,114,bike,low,1,0,05-10-2016,16:30:00,2016-10-05 16:30:00,2016-10-05,16:30:00,16,30,2,Wednesday,40,19.75736568457539,2,1
36,BHMBCCMKT01,577,26.14453614,91.73617216,58,car,low,1,0,06-10-2016,07:57:00,2016-10-06 07:57:00,2016-10-06,07:57:00,7,57,3,Thursday,40,10.051993067590988,3,1
37,BHMBCCMKT01,577,26.14453614,91.73617216,63,car,low,1,0,06-10-2016,08:30:00,2016-10-06 08:30:00,2016-10-06,08:30:00,8,30,3,Thursday,40,10.918544194107453,3,1
38,BHMBCCMKT01,577,26.14453614,91.73617216,70,car,low,1,0,06-10-2016,08:57:00,2016-10-06 08:57:00,2016-10-06,08:57:00,8,57,3,Thursday,40,12.131715771230503,3,1
39,BHMBCCMKT01,577,26.14453614,91.73617216,95,car,low,2,0,06-10-2016,09:30:00,2016-10-06 09:30:00,2016-10-06,09:30:00,9,30,3,Thursday,40,16.464471403812826,3,1
40,BHMBCCMKT01,577,26.14453614,91.73617216,135,car,low,3,0,06-10-2016,10:03:00,2016-10-06 10:03:00,2016-10-06,10:03:00,10,3,3,Thursday,40,23.39688041594454,3,1
41,BHMBCCMKT01,577,26.14453614,91.73617216,160,car,average,3,0,06-10-2016,10:30:00,2016-10-06 10:30:00,2016-10-06,10:30:00,10,30,3,Thursday,40,27.729636048526864,3,2
42,BHMBCCMKT01,577,26.14453614,91.73617216,177,car,average,3,0,06-10-2016,10:57:00,2016-10-06 10:57:00,2016-10-06,10:57:00,10,57,3,Thursday,40,30.675909878682845,3,2
43,BHMBCCMKT01,577,26.14453614,91.73617216,191,cycle,average,4,0,06-10-2016,11:30:00,2016-10-06 11:30:00,2016-10-06,11:30:00,11,30,3,Thursday,40,33.10225303292894,1,2
44,BHMBCCMKT01,577,26.14453614,91.73617216,199,car,high,7,0,06-10-2016,12:04:00,2016-10-06 12:04:00,2016-10-06,12:04:00,12,4,3,Thursday,40,34.48873483535528,3,3
45,BHMBCCMKT01,577,26.14453614,91.73617216,206,car,high,7,0,06-10-2016,12:30:00,2016-10-06 12:30:00,2016-10-06,12:30:00,12,30,3,Thursday,40,35.70190641247834,3,3
46,BHMBCCMKT01,577,26.14453614,91.73617216,198,car,average,5,0,06-10-2016,12:57:00,2016-10-06 12:57:00,2016-10-06,12:57:00,12,57,3,Thursday,40,34.31542461005199,3,2
47,BHMBCCMKT01,577,26.14453614,91.73617216,208,bike,high,7,0,06-10-2016,13:30:00,2016-10-06 13:30:00,2016-10-06,13:30:00,13,30,3,Thursday,40,36.04852686308492,2,3
48,BHMBCCMKT01,577,26.14453614,91.73617216,200,car,average,5,0,06-10-2016,13:57:00,2016-10-06 13:57:00,2016-10-06,13:57:00,13,57,3,Thursday,40,34.66204506065858,3,2
49,BHMBCCMKT01,577,26.14453614,91.73617216,175,cycle,average,3,0,06-10-2016,14:30:00,2016-10-06 14:30:00,2016-10-06,14:30:00,14,30,3,Thursday,40,30.329289428076255,1,2
50,BHMBCCMKT01,577,26.14453614,91.73617216,158,car,low,2,0,06-10-2016,15:04:00,2016-10-06 15:04:00,2016-10-06,15:04:00,15,4,3,Thursday,40,27.38301559792028,3,1
51,BHMBCCMKT01,577,26.14453614,91.73617216,153,bike,low,2,0,06-10-2016,15:31:00,2016-10-06 15:31:00,2016-10-06,15:31:00,15,31,3,Thursday,40,26.51646447140381,2,1
52,BHMBCCMKT01,577,26.14453614,91.73617216,135,bike,low,1,0,06-10-2016,16:04:00,2016-10-06 16:04:00,2016-10-06,16:04:00,16,4,3,Thursday,40,23.39688041594454,2,1
53,BHMBCCMKT01,577,26.14453614,91.73617216,129,car,low,2,0,06-10-2016,16:30:00,2016-10-06 16:30:00,2016-10-06,16:30:00,16,30,3,Thursday,40,22.357019064124785,3,1
54,BHMBCCMKT01,577,26.14453614,91.73617216,58,car,low,2,0,07-10-2016,08:03:00,2016-10-07 08:03:00,2016-10-07,08:03:00,8,3,4,Friday,40,10.051993067590988,3,1
55,BHMBCCMKT01,577,26.14453614,91.73617216,61,car,average,2,0,07-10-2016,08:30:00,2016-10-07 08:30:00,2016-10-07,08:30:00,8,30,4,Friday,40,10.571923743500866,3,2
56,BHMBCCMKT01,577,26.14453614,91.73617216,75,car,low,1,0,07-10-2016,09:04:00,2016-10-07 09:04:00,2016-10-07,09:04:00,9,4,4,Friday,40,12.99826689774697,3,1
57,BHMBCCMKT01,577,26.14453614,91.73617216,103,car,low,2,0,07-10-2016,09:30:00,2016-10-07 09:30:00,2016-10-07,09:30:00,9,30,4,Friday,40,17.85095320623917,3,1
58,BHMBCCMKT01,577,26.14453614,91.73617216,128,bike,low,2,0,07-10-2016,09:57:00,2016-10-07 09:57:00,2016-10-07,09:57:00,9,57,4,Friday,40,22.183708838821488,2,1
59,BHMBCCMKT01,577,26.14453614,91.73617216,172,truck,high,5,0,07-10-2016,10:30:00,2016-10-07 10:30:00,2016-10-07,10:30:00,10,30,4,Friday,40,29.809358752166375,4,3
60,BHMBCCMKT01,577,26.14453614,91.73617216,188,car,average,3,0,07-10-2016,10:57:00,2016-10-07 10:57:00,2016-10-07,10:57:00,10,57,4,Friday,40,32.582322357019066,3,2
61,BHMBCCMKT01,577,26.14453614,91.73617216,199,bike,average,4,0,07-10-2016,11:30:00,2016-10-07 11:30:00,2016-10-07,11:30:00,11,30,4,Friday,40,34.48873483535528,2,2
62,BHMBCCMKT01,577,26.14453614,91.73617216,210,car,high,7,0,07-10-2016,12:03:00,2016-10-07 12:03:00,2016-10-07,12:03:00,12,3,4,Friday,40,36.3951473136915,3,3
63,BHMBCCMKT01,577,26.14453614,91.73617216,206,bike,high,7,0,07-10-2016,12:30:00,2016-10-07 12:30:00,2016-10-07,12:30:00,12,30,4,Friday,40,35.70190641247834,2,3
64,BHMBCCMKT01,577,26.14453614,91.73617216,200,car,high,7,0,07-10-2016,13:04:00,2016-10-07 13:04:00,2016-10-07,13:04:00,13,4,4,Friday,40,34.66204506065858,3,3
65,BHMBCCMKT01,577,26.14453614,91.73617216,201,car,high,7,0,07-10-2016,13:30:00,2016-10-07 13:30:00,2016-10-07,13:30:00,13,30,4,Friday,40,34.835355285961874,3,3
66,BHMBCCMKT01,577,26.14453614,91.73617216,193,bike,average,3,0,07-10-2016,14:03:00,2016-10-07 14:03:00,2016-10-07,14:03:00,14,3,4,Friday,40,33.44887348353553,2,2
67,BHMBCCMKT01,577,26.14453614,91.73617216,181,car,average,4,0,07-10-2016,14:30:00,2016-10-07 14:30:00,2016-10-07,14:30:00,14,30,4,Friday,40,31.369150779896017,3,2
68,BHMBCCMKT01,577,26.14453614,91.73617216,172,truck,low,2,0,07-10-2016,15:04:00,2016-10-07 15:04:00,2016-10-07,15:04:00,15,4,4,Friday,40,29.809358752166375,4,1
69,BHMBCCMKT01,577,26.14453614,91.73617216,159,cycle,low,2,0,07-10-2016,15:30:00,2016-10-07 15:30:00,2016-10-07,15:30:00,15,30,4,Friday,40,27.55632582322357,1,1
70,BHMBCCMKT01,577,26.14453614,91.73617216,158,cycle,low,2,0,07-10-2016,15:57:00,2016-10-07 15:57:00,2016-10-07,15:57:00,15,57,4,Friday,40,27.38301559792028,1,1
71,BHMBCCMKT01,577,26.14453614,91.73617216,132,car,low,2,0,07-10-2016,16:30:00,2016-10-07 16:30:00,2016-10-07,16:30:00,16,30,4,Friday,40,22.876949740034664,3,1
72,BHMBCCMKT01,577,26.14453614,91.73617216,58,car,low,1,0,08-10-2016,07:57:00,2016-10-08 07:57:00,2016-10-08,07:57:00,7,57,5,Saturday,40,10.051993067590988,3,1
73,BHMBCCMKT01,577,26.14453614,91.73617216,61,car,average,2,0,08-10-2016,08:30:00,2016-10-08 08:30:00,2016-10-08,08:30:00,8,30,5,Saturday,40,10.571923743500866,3,2
74,BHMBCCMKT01,577,26.14453614,91.73617216,75,truck,low,1,0,08-10-2016,08:57:00,2016-10-08 08:57:00,2016-10-08,08:57:00,8,57,5,Saturday,40,12.99826689774697,4,1
75,BHMBCCMKT01,577,26.14453614,91.73617216,104,car,low,2,0,08-10-2016,09:30:00,2016-10-08 09:30:00,2016-10-08,09:30:00,9,30,5,Saturday,40,18.02426343154246,3,1
76,BHMBCCMKT01,577,26.14453614,91.73617216,158,car,low,3,0,08-10-2016,10:04:00,2016-10-08 10:04:00,2016-10-08,10:04:00,10,4,5,Saturday,40,27.38301559792028,3,1
77,BHMBCCMKT01,577,26.14453614,91.73617216,191,truck,average,3,0,08-10-2016,10:30:00,2016-10-08 10:30:00,2016-10-08,10:30:00,10,30,5,Saturday,40,33.10225303292894,4,2
78,BHMBCCMKT01,577,26.14453614,91.73617216,223,truck,average,4,0,08-10-2016,10:57:00,2016-10-08 10:57:00,2016-10-08,10:57:00,10,57,5,Saturday,40,38.64818024263432,4,2
79,BHMBCCMKT01,577,26.14453614,91.73617216,254,car,average,4,0,08-10-2016,11:30:00,2016-10-08 11:30:00,2016-10-08,11:30:00,11,30,5,Saturday,40,44.0207972270364,3,2
80,BHMBCCMKT01,577,26.14453614,91.73617216,306,car,high,7,0,08-10-2016,12:04:00,2016-10-08 12:04:00,2016-10-08,12:04:00,12,4,5,Saturday,40,53.03292894280762,3,3
81,BHMBCCMKT01,577,26.14453614,91.73617216,320,car,high,8,0,08-10-2016,12:30:00,2016-10-08 12:30:00,2016-10-08,12:30:00,12,30,5,Saturday,40,55.45927209705373,3,3
82,BHMBCCMKT01,577,26.14453614,91.73617216,348,car,high,7,0,08-10-2016,13:04:00,2016-10-08 13:04:00,2016-10-08,13:04:00,13,4,5,Saturday,40,60.31195840554593,3,3
83,BHMBCCMKT01,577,26.14453614,91.73617216,357,car,high,7,0,08-10-2016,13:30:00,2016-10-08 13:30:00,2016-10-08,13:30:00,13,30,5,Saturday,40,61.871750433275565,3,3
84,BHMBCCMKT01,577,26.14453614,91.73617216,395,bike,average,4,0,08-10-2016,14:03:00,2016-10-08 14:03:00,2016-10-08,14:03:00,14,3,5,Saturday,40,68.4575389948007,2,2
85,BHMBCCMKT01,577,26.14453614,91.73617216,400,car,average,4,0,08-10-2016,14:30:00,2016-10-08 14:30:00,2016-10-08,14:30:00,14,30,5,Saturday,40,69.32409012131716,3,2
86,BHMBCCMKT01,577,26.14453614,91.73617216,395,car,average,4,0,08-10-2016,14:57:00,2016-10-08 14:57:00,2016-10-08,14:57:00,14,57,5,Saturday,40,68.4575389948007,3,2
87,BHMBCCMKT01,577,26.14453614,91.73617216,406,car,average,3,0,08-10-2016,15:30:00,2016-10-08 15:30:00,2016-10-08,15:30:00,15,30,5,Saturday,40,70.36395147313691,3,2
88,BHMBCCMKT01,577,26.14453614,91.73617216,381,car,low,2,0,08-10-2016,16:04:00,2016-10-08 16:04:00,2016-10-08,16:04:00,16,4,5,Saturday,40,66.03119584055459,3,1
89,BHMBCCMKT01,577,26.14453614,91.73617216,365,truck,low,2,0,08-10-2016,16:30:00,2016-10-08 16:30:00,2016-10-08,16:30:00,16,30,5,Saturday,40,63.258232235701904,4,1
90,BHMBCCMKT01,577,26.14453614,91.73617216,42,car,low,2,1,09-10-2016,08:04:00,2016-10-09 08:04:00,2016-10-09,08:04:00,8,4,6,Sunday,40,7.279029462738301,3,1
91,BHMBCCMKT01,577,26.14453614,91.73617216,42,bike,low,2,1,09-10-2016,08:30:00,2016-10-09 08:30:00,2016-10-09,08:30:00,8,30,6,Sunday,40,7.279029462738301,2,1
92,BHMBCCMKT01,577,26.14453614,91.73617216,43,car,low,2,1,09-10-2016,09:04:00,2016-10-09 09:04:00,2016-10-09,09:04:00,9,4,6,Sunday,40,7.452339688041594,3,1
93,BHMBCCMKT01,577,26.14453614,91.73617216,43,cycle,low,2,1,09-10-2016,09:30:00,2016-10-09 09:30:00,2016-10-09,09:30:00,9,30,6,Sunday,40,7.452339688041594,1,1
94,BHMBCCMKT01,577,26.14453614,91.73617216,50,car,average,3,1,09-10-2016,09:57:00,2016-10-09 09:57:00,2016-10-09,09:57:00,9,57,6,Sunday,40,8.665511265164644,3,2
95,BHMBCCMKT01,577,26.14453614,91.73617216,64,cycle,high,5,1,09-10-2016,10:30:00,2016-10-09 10:30:00,2016-10-09,10:30:00,10,30,6,Sunday,40,11.091854419410744,1,3
96,BHMBCCMKT01,577,26.14453614,91.73617216,100,truck,average,6,1,09-10-2016,11:04:00,2016-10-09 11:04:00,2016-10-09,11:04:00,11,4,6,Sunday,40,17.33102253032929,4,2
97,BHMBCCMKT01,577,26.14453614,91.73617216,126,car,average,6,1,09-10-2016,11:30:00,2016-10-09 11:30:00,2016-10-09,11:30:00,11,30,6,Sunday,40,21.837088388214905,3,2
98,BHMBCCMKT01,577,26.14453614,91.73617216,148,car,average,6,1,09-10-2016,11:57:00,2016-10-09 11:57:00,2016-10-09,11:57:00,11,57,6,Sunday,40,25.64991334488735,3,2
99,BHMBCCMKT01,577,26.14453614,91.73617216,170,truck,high,9,1,09-10-2016,12:30:00,2016-10-09 12:30:00,2016-10-09,12:30:00,12,30,6,Sunday,40,29.462738301559792,4,3
100,BHMBCCMKT01,577,26.14453614,91.73617216,189,car,high,8,1,09-10-2016,13:04:00,2016-10-09 13:04:00,2016-10-09,13:04:00,13,4,6,Sunday,40,32.755632582322356,3,3
101,BHMBCCMKT01,577,26.14453614,91.73617216,205,bike,high,9,1,09-10-2016,13:30:00,2016-10-09 13:30:00,2016-10-09,13:30:00,13,30,6,Sunday,40,35.52859618717504,2,3
102,BHMBCCMKT01,577,26.14453614,91.73617216,208,cycle,high,7,1,09-10-2016,14:03:00,2016-10-09 14:03:00,2016-10-09,14:03:00,14,3,6,Sunday,40,36.04852686308492,1,3
103,BHMBCCMKT01,577,26.14453614,91.73617216,209,car,average,5,1,09-10-2016,14:30:00,2016-10-09 14:30:00,2016-10-09,14:30:00,14,30,6,Sunday,40,36.22183708838821,3,2
104,BHMBCCMKT01,577,26.14453614,91.73617216,191,car,low,3,1,09-10-2016,15:04:00,2016-10-09 15:04:00,2016-10-09,15:04:00,15,4,6,Sunday,40,33.10225303292894,3,1
105,BHMBCCMKT01,577,26.14453614,91.73617216,180,car,low,3,1,09-10-2016,15:30:00,2016-10-09 15:30:00,2016-10-09,15:30:00,15,30,6,Sunday,40,31.195840554592717,3,1
106,BHMBCCMKT01,577,26.14453614,91.73617216,155,truck,low,3,1,09-10-2016,16:03:00,2016-10-09 16:03:00,2016-10-09,16:03:00,16,3,6,Sunday,40,26.8630849220104,4,1
107,BHMBCCMKT01,577,26.14453614,91.73617216,133,car,low,2,1,09-10-2016,16:30:00,2016-10-09 16:30:00,2016-10-09,16:30:00,16,30,6,Sunday,40,23.050259965337954,3,1
108,BHMBCCMKT01,577,26.14453614,91.73617216,54,bike,low,1,0,10-10-2016,08:04:00,2016-10-10 08:04:00,2016-10-10,08:04:00,8,4,0,Monday,41,9.358752166377817,2,1
109,BHMBCCMKT01,577,26.14453614,91.73617216,56,truck,low,1,0,10-10-2016,08:30:00,2016-10-10 08:30:00,2016-10-10,08:30:00,8,30,0,Monday,41,9.705372616984402,4,1
110,BHMBCCMKT01,577,26.14453614,91.73617216,65,car,low,1,0,10-10-2016,09:04:00,2016-10-10 09:04:00,2016-10-10,09:04:00,9,4,0,Monday,41,11.265164644714037,3,1
111,BHMBCCMKT01,577,26.14453614,91.73617216,73,bike,low,2,0,10-10-2016,09:30:00,2016-10-10 09:30:00,2016-10-10,09:30:00,9,30,0,Monday,41,12.65164644714038,2,1
112,BHMBCCMKT01,577,26.14453614,91.73617216,92,cycle,low,2,0,10-10-2016,10:03:00,2016-10-10 10:03:00,2016-10-10,10:03:00,10,3,0,Monday,41,15.944540727902945,1,1
113,BHMBCCMKT01,577,26.14453614,91.73617216,113,cycle,average,4,0,10-10-2016,10:30:00,2016-10-10 10:30:00,2016-10-10,10:30:00,10,30,0,Monday,41,19.584055459272097,1,2
114,BHMBCCMKT01,577,26.14453614,91.73617216,144,car,average,3,0,10-10-2016,10:57:00,2016-10-10 10:57:00,2016-10-10,10:57:00,10,57,0,Monday,41,24.956672443674176,3,2
115,BHMBCCMKT01,577,26.14453614,91.73617216,149,car,average,4,0,10-10-2016,11:30:00,2016-10-10 11:30:00,2016-10-10,11:30:00,11,30,0,Monday,41,25.82322357019064,3,2
116,BHMBCCMKT01,577,26.14453614,91.73617216,159,car,average,4,0,10-10-2016,11:57:00,2016-10-10 11:57:00,2016-10-10,11:57:00,11,57,0,Monday,41,27.55632582322357,3,2
117,BHMBCCMKT01,577,26.14453614,91.73617216,171,car,high,6,0,10-10-2016,12:30:00,2016-10-10 12:30:00,2016-10-10,12:30:00,12,30,0,Monday,41,29.636048526863085,3,3
118,BHMBCCMKT01,577,26.14453614,91.73617216,176,truck,average,5,0,10-10-2016,13:04:00,2016-10-10 13:04:00,2016-10-10,13:04:00,13,4,0,Monday,41,30.502599653379548,4,2
119,BHMBCCMKT01,577,26.14453614,91.73617216,172,car,high,6,0,10-10-2016,13:30:00,2016-10-10 13:30:00,2016-10-10,13:30:00,13,30,0,Monday,41,29.809358752166375,3,3
120,BHMBCCMKT01,577,26.14453614,91.73617216,161,car,high,5,0,10-10-2016,14:03:00,2016-10-10 14:03:00,2016-10-10,14:03:00,14,3,0,Monday,41,27.902946273830153,3,3
121,BHMBCCMKT01,577,26.14453614,91.73617216,154,car,average,3,0,10-10-2016,14:30:00,2016-10-10 14:30:00,2016-10-10,14:30:00,14,30,0,Monday,41,26.689774696707108,3,2
122,BHMBCCMKT01,577,26.14453614,91.73617216,137,car,average,4,0,10-10-2016,14:57:00,2016-10-10 14:57:00,2016-10-10,14:57:00,14,57,0,Monday,41,23.743500866551127,3,2
123,BHMBCCMKT01,577,26.14453614,91.73617216,129,bike,low,1,0,10-10-2016,15:30:00,2016-10-10 15:30:00,2016-10-10,15:30:00,15,30,0,Monday,41,22.357019064124785,2,1
124,BHMBCCMKT01,577,26.14453614,91.73617216,130,car,average,3,0,10-10-2016,15:57:00,2016-10-10 15:57:00,2016-10-10,15:57:00,15,57,0,Monday,41,22.530329289428074,3,2
125,BHMBCCMKT01,577,26.14453614,91.73617216,114,truck,low,2,0,10-10-2016,16:30:00,2016-10-10 16:30:00,2016-10-10,16:30:00,16,30,0,Monday,41,19.75736568457539,4,1
126,BHMBCCMKT01,577,26.14453614,91.73617216,56,bike,average,1,0,11-10-2016,08:04:00,2016-10-11 08:04:00,2016-10-11,08:04:00,8,4,1,Tuesday,41,9.705372616984402,2,2
127,BHMBCCMKT01,577,26.14453614,91.73617216,64,car,low,1,0,11-10-2016,08:30:00,2016-10-11 08:30:00,2016-10-11,08:30:00,8,30,1,Tuesday,41,11.091854419410744,3,1
128,BHMBCCMKT01,577,26.14453614,91.73617216,74,truck,low,1,0,11-10-2016,08:57:00,2016-10-11 08:57:00,2016-10-11,08:57:00,8,57,1,Tuesday,41,12.824956672443674,4,1
129,BHMBCCMKT01,577,26.14453614,91.73617216,93,bike,low,2,0,11-10-2016,09:30:00,2016-10-11 09:30:00,2016-10-11,09:30:00,9,30,1,Tuesday,41,16.11785095320624,2,1
130,BHMBCCMKT01,577,26.14453614,91.73617216,129,bike,average,2,0,11-10-2016,09:57:00,2016-10-11 09:57:00,2016-10-11,09:57:00,9,57,1,Tuesday,41,22.357019064124785,2,2
131,BHMBCCMKT01,577,26.14453614,91.73617216,167,car,average,3,0,11-10-2016,10:30:00,2016-10-11 10:30:00,2016-10-11,10:30:00,10,30,1,Tuesday,41,28.942807625649912,3,2
132,BHMBCCMKT01,577,26.14453614,91.73617216,200,car,average,3,0,11-10-2016,10:57:00,2016-10-11 10:57:00,2016-10-11,10:57:00,10,57,1,Tuesday,41,34.66204506065858,3,2
133,BHMBCCMKT01,577,26.14453614,91.73617216,219,car,average,5,0,11-10-2016,11:30:00,2016-10-11 11:30:00,2016-10-11,11:30:00,11,30,1,Tuesday,41,37.954939341421145,3,2
134,BHMBCCMKT01,577,26.14453614,91.73617216,225,car,high,7,0,11-10-2016,12:03:00,2016-10-11 12:03:00,2016-10-11,12:03:00,12,3,1,Tuesday,41,38.9948006932409,3,3
135,BHMBCCMKT01,577,26.14453614,91.73617216,221,cycle,high,8,0,11-10-2016,12:30:00,2016-10-11 12:30:00,2016-10-11,12:30:00,12,30,1,Tuesday,41,38.30155979202773,1,3
136,BHMBCCMKT01,577,26.14453614,91.73617216,217,cycle,high,6,0,11-10-2016,13:04:00,2016-10-11 13:04:00,2016-10-11,13:04:00,13,4,1,Tuesday,41,37.60831889081456,1,3
137,BHMBCCMKT01,577,26.14453614,91.73617216,217,cycle,high,6,0,11-10-2016,13:31:00,2016-10-11 13:31:00,2016-10-11,13:31:00,13,31,1,Tuesday,41,37.60831889081456,1,3
138,BHMBCCMKT01,577,26.14453614,91.73617216,208,bike,average,4,0,11-10-2016,14:04:00,2016-10-11 14:04:00,2016-10-11,14:04:00,14,4,1,Tuesday,41,36.04852686308492,2,2
139,BHMBCCMKT01,577,26.14453614,91.73617216,191,car,average,3,0,11-10-2016,14:30:00,2016-10-11 14:30:00,2016-10-11,14:30:00,14,30,1,Tuesday,41,33.10225303292894,3,2
140,BHMBCCMKT01,577,26.14453614,91.73617216,167,bike,low,2,0,11-10-2016,15:03:00,2016-10-11 15:03:00,2016-10-11,15:03:00,15,3,1,Tuesday,41,28.942807625649912,2,1
141,BHMBCCMKT01,577,26.14453614,91.73617216,159,car,low,2,0,11-10-2016,15:33:00,2016-10-11 15:33:00,2016-10-11,15:33:00,15,33,1,Tuesday,41,27.55632582322357,3,1
142,BHMBCCMKT01,577,26.14453614,91.73617216,150,bike,low,1,0,11-10-2016,16:01:00,2016-10-11 16:01:00,2016-10-11,16:01:00,16,1,1,Tuesday,41,25.99653379549394,2,1
143,BHMBCCMKT01,577,26.14453614,91.73617216,127,car,low,2,0,11-10-2016,16:26:00,2016-10-11 16:26:00,2016-10-11,16:26:00,16,26,1,Tuesday,41,22.0103986135182,3,1
144,BHMBCCMKT01,577,26.14453614,91.73617216,51,bike,low,1,0,12-10-2016,08:04:00,2016-10-12 08:04:00,2016-10-12,08:04:00,8,4,2,Wednesday,41,8.838821490467938,2,1
145,BHMBCCMKT01,577,26.14453614,91.73617216,57,car,low,2,0,12-10-2016,08:31:00,2016-10-12 08:31:00,2016-10-12,08:31:00,8,31,2,Wednesday,41,9.878682842287695,3,1
146,BHMBCCMKT01,577,26.14453614,91.73617216,64,bike,low,1,0,12-10-2016,09:03:00,2016-10-12 09:03:00,2016-10-12,09:03:00,9,3,2,Wednesday,41,11.091854419410744,2,1
147,BHMBCCMKT01,577,26.14453614,91.73617216,73,car,low,1,0,12-10-2016,09:26:00,2016-10-12 09:26:00,2016-10-12,09:26:00,9,26,2,Wednesday,41,12.65164644714038,3,1
148,BHMBCCMKT01,577,26.14453614,91.73617216,99,car,average,3,0,12-10-2016,10:01:00,2016-10-12 10:01:00,2016-10-12,10:01:00,10,1,2,Wednesday,41,17.157712305025996,3,2
149,BHMBCCMKT01,577,26.14453614,91.73617216,112,bike,average,3,0,12-10-2016,10:31:00,2016-10-12 10:31:00,2016-10-12,10:31:00,10,31,2,Wednesday,41,19.410745233968804,2,2
150,BHMBCCMKT01,577,26.14453614,91.73617216,127,bike,average,4,0,12-10-2016,11:04:00,2016-10-12 11:04:00,2016-10-12,11:04:00,11,4,2,Wednesday,41,22.0103986135182,2,2
151,BHMBCCMKT01,577,26.14453614,91.73617216,128,car,average,4,0,12-10-2016,11:31:00,2016-10-12 11:31:00,2016-10-12,11:31:00,11,31,2,Wednesday,41,22.183708838821488,3,2
152,BHMBCCMKT01,577,26.14453614,91.73617216,143,car,high,6,0,12-10-2016,12:04:00,2016-10-12 12:04:00,2016-10-12,12:04:00,12,4,2,Wednesday,41,24.783362218370883,3,3
153,BHMBCCMKT01,577,26.14453614,91.73617216,158,car,average,5,0,12-10-2016,12:31:00,2016-10-12 12:31:00,2016-10-12,12:31:00,12,31,2,Wednesday,41,27.38301559792028,3,2
154,BHMBCCMKT01,577,26.14453614,91.73617216,157,bike,high,6,0,12-10-2016,13:04:00,2016-10-12 13:04:00,2016-10-12,13:04:00,13,4,2,Wednesday,41,27.209705372616984,2,3
155,BHMBCCMKT01,577,26.14453614,91.73617216,164,car,high,6,0,12-10-2016,13:34:00,2016-10-12 13:34:00,2016-10-12,13:34:00,13,34,2,Wednesday,41,28.422876949740033,3,3
156,BHMBCCMKT01,577,26.14453614,91.73617216,167,bike,high,5,0,12-10-2016,14:03:00,2016-10-12 14:03:00,2016-10-12,14:03:00,14,3,2,Wednesday,41,28.942807625649912,2,3
157,BHMBCCMKT01,577,26.14453614,91.73617216,159,bike,average,4,0,12-10-2016,14:34:00,2016-10-12 14:34:00,2016-10-12,14:34:00,14,34,2,Wednesday,41,27.55632582322357,2,2
158,BHMBCCMKT01,577,26.14453614,91.73617216,140,car,low,2,0,12-10-2016,15:01:00,2016-10-12 15:01:00,2016-10-12,15:01:00,15,1,2,Wednesday,41,24.263431542461007,3,1
159,BHMBCCMKT01,577,26.14453614,91.73617216,128,truck,low,2,0,12-10-2016,15:30:00,2016-10-12 15:30:00,2016-10-12,15:30:00,15,30,2,Wednesday,41,22.183708838821488,4,1
160,BHMBCCMKT01,577,26.14453614,91.73617216,121,car,low,2,0,12-10-2016,15:57:00,2016-10-12 15:57:00,2016-10-12,15:57:00,15,57,2,Wednesday,41,20.97053726169844,3,1
161,BHMBCCMKT01,577,26.14453614,91.73617216,111,cycle,average,2,0,12-10-2016,16:31:00,2016-10-12 16:31:00,2016-10-12,16:31:00,16,31,2,Wednesday,41,19.23743500866551,1,2
162,BHMBCCMKT01,577,26.14453614,91.73617216,58,car,low,2,0,13-10-2016,07:57:00,2016-10-13 07:57:00,2016-10-13,07:57:00,7,57,3,Thursday,41,10.051993067590988,3,1
163,BHMBCCMKT01,577,26.14453614,91.73617216,65,car,low,1,0,13-10-2016,08:31:00,2016-10-13 08:31:00,2016-10-13,08:31:00,8,31,3,Thursday,41,11.265164644714037,3,1
164,BHMBCCMKT01,577,26.14453614,91.73617216,76,car,low,2,0,13-10-2016,09:04:00,2016-10-13 09:04:00,2016-10-13,09:04:00,9,4,3,Thursday,41,13.171577123050259,3,1
165,BHMBCCMKT01,577,26.14453614,91.73617216,97,cycle,low,2,0,13-10-2016,09:31:00,2016-10-13 09:31:00,2016-10-13,09:31:00,9,31,3,Thursday,41,16.81109185441941,1,1
166,BHMBCCMKT01,577,26.14453614,91.73617216,127,bike,low,2,0,13-10-2016,09:57:00,2016-10-13 09:57:00,2016-10-13,09:57:00,9,57,3,Thursday,41,22.0103986135182,2,1
167,BHMBCCMKT01,577,26.14453614,91.73617216,166,car,average,4,0,13-10-2016,10:31:00,2016-10-13 10:31:00,2016-10-13,10:31:00,10,31,3,Thursday,41,28.769497400346623,3,2
168,BHMBCCMKT01,577,26.14453614,91.73617216,200,truck,average,4,0,13-10-2016,11:04:00,2016-10-13 11:04:00,2016-10-13,11:04:00,11,4,3,Thursday,41,34.66204506065858,4,2
169,BHMBCCMKT01,577,26.14453614,91.73617216,220,car,average,4,0,13-10-2016,11:31:00,2016-10-13 11:31:00,2016-10-13,11:31:00,11,31,3,Thursday,41,38.128249566724435,3,2
170,BHMBCCMKT01,577,26.14453614,91.73617216,230,car,average,4,0,13-10-2016,11:57:00,2016-10-13 11:57:00,2016-10-13,11:57:00,11,57,3,Thursday,41,39.86135181975737,3,2
171,BHMBCCMKT01,577,26.14453614,91.73617216,231,cycle,high,7,0,13-10-2016,12:31:00,2016-10-13 12:31:00,2016-10-13,12:31:00,12,31,3,Thursday,41,40.03466204506066,1,3
172,BHMBCCMKT01,577,26.14453614,91.73617216,214,car,high,6,0,13-10-2016,13:04:00,2016-10-13 13:04:00,2016-10-13,13:04:00,13,4,3,Thursday,41,37.088388214904676,3,3
173,BHMBCCMKT01,577,26.14453614,91.73617216,203,cycle,high,6,0,13-10-2016,13:31:00,2016-10-13 13:31:00,2016-10-13,13:31:00,13,31,3,Thursday,41,35.181975736568454,1,3
174,BHMBCCMKT01,577,26.14453614,91.73617216,205,car,average,5,0,13-10-2016,13:57:00,2016-10-13 13:57:00,2016-10-13,13:57:00,13,57,3,Thursday,41,35.52859618717504,3,2
175,BHMBCCMKT01,577,26.14453614,91.73617216,181,truck,average,4,0,13-10-2016,14:31:00,2016-10-13 14:31:00,2016-10-13,14:31:00,14,31,3,Thursday,41,31.369150779896017,4,2
176,BHMBCCMKT01,577,26.14453614,91.73617216,162,car,low,2,0,13-10-2016,15:04:00,2016-10-13 15:04:00,2016-10-13,15:04:00,15,4,3,Thursday,41,28.07625649913345,3,1
177,BHMBCCMKT01,577,26.14453614,91.73617216,144,cycle,low,2,0,13-10-2016,15:31:00,2016-10-13 15:31:00,2016-10-13,15:31:00,15,31,3,Thursday,41,24.956672443674176,1,1
178,BHMBCCMKT01,577,26.14453614,91.73617216,132,car,low,2,0,13-10-2016,16:04:00,2016-10-13 16:04:00,2016-10-13,16:04:00,16,4,3,Thursday,41,22.876949740034664,3,1
179,BHMBCCMKT01,577,26.14453614,91.73617216,130,car,low,2,0,13-10-2016,16:31:00,2016-10-13 16:31:00,2016-10-13,16:31:00,16,31,3,Thursday,41,22.530329289428074,3,1
180,BHMBCCMKT01,577,26.14453614,91.73617216,53,car,low,1,0,14-10-2016,08:01:00,2016-10-14 08:01:00,2016-10-14,08:01:00,8,1,4,Friday,41,9.185441941074524,3,1
181,BHMBCCMKT01,577,26.14453614,91.73617216,57,car,low,1,0,14-10-2016,08:27:00,2016-10-14 08:27:00,2016-10-14,08:27:00,8,27,4,Friday,41,9.878682842287695,3,1
182,BHMBCCMKT01,577,26.14453614,91.73617216,67,car,average,2,0,14-10-2016,09:01:00,2016-10-14 09:01:00,2016-10-14,09:01:00,9,1,4,Friday,41,11.611785095320624,3,2
183,BHMBCCMKT01,577,26.14453614,91.73617216,100,car,low,2,0,14-10-2016,09:27:00,2016-10-14 09:27:00,2016-10-14,09:27:00,9,27,4,Friday,41,17.33102253032929,3,1
184,BHMBCCMKT01,577,26.14453614,91.73617216,134,car,low,2,0,14-10-2016,10:01:00,2016-10-14 10:01:00,2016-10-14,10:01:00,10,1,4,Friday,41,23.223570190641247,3,1
185,BHMBCCMKT01,577,26.14453614,91.73617216,157,car,low,3,0,14-10-2016,10:27:00,2016-10-14 10:27:00,2016-10-14,10:27:00,10,27,4,Friday,41,27.209705372616984,3,1
186,BHMBCCMKT01,577,26.14453614,91.73617216,205,car,average,5,0,14-10-2016,11:01:00,2016-10-14 11:01:00,2016-10-14,11:01:00,11,1,4,Friday,41,35.52859618717504,3,2
187,BHMBCCMKT01,577,26.14453614,91.73617216,220,car,average,5,0,14-10-2016,11:27:00,2016-10-14 11:27:00,2016-10-14,11:27:00,11,27,4,Friday,41,38.128249566724435,3,2
188,BHMBCCMKT01,577,26.14453614,91.73617216,224,car,high,7,0,14-10-2016,12:01:00,2016-10-14 12:01:00,2016-10-14,12:01:00,12,1,4,Friday,41,38.82149046793761,3,3
189,BHMBCCMKT01,577,26.14453614,91.73617216,213,bike,average,5,0,14-10-2016,12:27:00,2016-10-14 12:27:00,2016-10-14,12:27:00,12,27,4,Friday,41,36.915077989601386,2,2
190,BHMBCCMKT01,577,26.14453614,91.73617216,205,truck,high,6,0,14-10-2016,13:01:00,2016-10-14 13:01:00,2016-10-14,13:01:00,13,1,4,Friday,41,35.52859618717504,4,3
191,BHMBCCMKT01,577,26.14453614,91.73617216,201,car,high,7,0,14-10-2016,13:27:00,2016-10-14 13:27:00,2016-10-14,13:27:00,13,27,4,Friday,41,34.835355285961874,3,3
192,BHMBCCMKT01,577,26.14453614,91.73617216,182,bike,average,4,0,14-10-2016,14:01:00,2016-10-14 14:01:00,2016-10-14,14:01:00,14,1,4,Friday,41,31.542461005199307,2,2
193,BHMBCCMKT01,577,26.14453614,91.73617216,174,bike,average,3,0,14-10-2016,14:34:00,2016-10-14 14:34:00,2016-10-14,14:34:00,14,34,4,Friday,41,30.155979202772965,2,2
194,BHMBCCMKT01,577,26.14453614,91.73617216,171,car,low,2,0,14-10-2016,15:01:00,2016-10-14 15:01:00,2016-10-14,15:01:00,15,1,4,Friday,41,29.636048526863085,3,1
195,BHMBCCMKT01,577,26.14453614,91.73617216,161,bike,low,2,0,14-10-2016,15:27:00,2016-10-14 15:27:00,2016-10-14,15:27:00,15,27,4,Friday,41,27.902946273830153,2,1
196,BHMBCCMKT01,577,26.14453614,91.73617216,138,car,low,1,0,14-10-2016,16:01:00,2016-10-14 16:01:00,2016-10-14,16:01:00,16,1,4,Friday,41,23.91681109185442,3,1
197,BHMBCCMKT01,577,26.14453614,91.73617216,134,car,low,2,0,14-10-2016,16:34:00,2016-10-14 16:34:00,2016-10-14,16:34:00,16,34,4,Friday,41,23.223570190641247,3,1
198,BHMBCCMKT01,577,26.14453614,91.73617216,53,bike,low,1,0,15-10-2016,08:01:00,2016-10-15 08:01:00,2016-10-15,08:01:00,8,1,5,Saturday,41,9.185441941074524,2,1
199,BHMBCCMKT01,577,26.14453614,91.73617216,63,car,low,1,0,15-10-2016,08:34:00,2016-10-15 08:34:00,2016-10-15,08:34:00,8,34,5,Saturday,41,10.918544194107453,3,1
200,BHMBCCMKT01,577,26.14453614,91.73617216,77,car,low,2,0,15-10-2016,09:01:00,2016-10-15 09:01:00,2016-10-15,09:01:00,9,1,5,Saturday,41,13.344887348353554,3,1
201,BHMBCCMKT01,577,26.14453614,91.73617216,101,car,low,2,0,15-10-2016,09:27:00,2016-10-15 09:27:00,2016-10-15,09:27:00,9,27,5,Saturday,41,17.504332755632582,3,1
202,BHMBCCMKT01,577,26.14453614,91.73617216,154,car,low,3,0,15-10-2016,10:01:00,2016-10-15 10:01:00,2016-10-15,10:01:00,10,1,5,Saturday,41,26.689774696707108,3,1
203,BHMBCCMKT01,577,26.14453614,91.73617216,171,car,low,3,0,15-10-2016,10:27:00,2016-10-15 10:27:00,2016-10-15,10:27:00,10,27,5,Saturday,41,29.636048526863085,3,1
204,BHMBCCMKT01,577,26.14453614,91.73617216,211,car,average,4,0,15-10-2016,11:01:00,2016-10-15 11:01:00,2016-10-15,11:01:00,11,1,5,Saturday,41,36.56845753899481,3,2
205,BHMBCCMKT01,577,26.14453614,91.73617216,239,car,average,4,0,15-10-2016,11:27:00,2016-10-15 11:27:00,2016-10-15,11:27:00,11,27,5,Saturday,41,41.421143847487,3,2
206,BHMBCCMKT01,577,26.14453614,91.73617216,276,car,high,8,0,15-10-2016,12:01:00,2016-10-15 12:01:00,2016-10-15,12:01:00,12,1,5,Saturday,41,47.83362218370884,3,3
207,BHMBCCMKT01,577,26.14453614,91.73617216,297,car,high,8,0,15-10-2016,12:27:00,2016-10-15 12:27:00,2016-10-15,12:27:00,12,27,5,Saturday,41,51.47313691507799,3,3
208,BHMBCCMKT01,577,26.14453614,91.73617216,332,car,high,7,0,15-10-2016,13:01:00,2016-10-15 13:01:00,2016-10-15,13:01:00,13,1,5,Saturday,41,57.538994800693246,3,3
209,BHMBCCMKT01,577,26.14453614,91.73617216,352,car,high,8,0,15-10-2016,13:34:00,2016-10-15 13:34:00,2016-10-15,13:34:00,13,34,5,Saturday,41,61.005199306759096,3,3
210,BHMBCCMKT01,577,26.14453614,91.73617216,391,car,high,6,0,15-10-2016,14:01:00,2016-10-15 14:01:00,2016-10-15,14:01:00,14,1,5,Saturday,41,67.76429809358753,3,3
211,BHMBCCMKT01,577,26.14453614,91.73617216,409,car,average,4,0,15-10-2016,14:27:00,2016-10-15 14:27:00,2016-10-15,14:27:00,14,27,5,Saturday,41,70.8838821490468,3,2
212,BHMBCCMKT01,577,26.14453614,91.73617216,442,car,low,3,0,15-10-2016,15:01:00,2016-10-15 15:01:00,2016-10-15,15:01:00,15,1,5,Saturday,41,76.60311958405546,3,1
213,BHMBCCMKT01,577,26.14453614,91.73617216,428,bike,low,3,0,15-10-2016,15:27:00,2016-10-15 15:27:00,2016-10-15,15:27:00,15,27,5,Saturday,41,74.17677642980935,2,1
214,BHMBCCMKT01,577,26.14453614,91.73617216,412,car,low,2,0,15-10-2016,16:01:00,2016-10-15 16:01:00,2016-10-15,16:01:00,16,1,5,Saturday,41,71.40381282495667,3,1
215,BHMBCCMKT01,577,26.14453614,91.73617216,393,bike,low,2,0,15-10-2016,16:27:00,2016-10-15 16:27:00,2016-10-15,16:27:00,16,27,5,Saturday,41,68.1109185441941,2,1
216,BHMBCCMKT01,577,26.14453614,91.73617216,48,car,low,2,1,16-10-2016,08:04:00,2016-10-16 08:04:00,2016-10-16,08:04:00,8,4,6,Sunday,41,8.31889081455806,3,1
217,BHMBCCMKT01,577,26.14453614,91.73617216,48,bike,low,2,1,16-10-2016,08:27:00,2016-10-16 08:27:00,2016-10-16,08:27:00,8,27,6,Sunday,41,8.31889081455806,2,1
218,BHMBCCMKT01,577,26.14453614,91.73617216,55,car,low,2,1,16-10-2016,09:01:00,2016-10-16 09:01:00,2016-10-16,09:01:00,9,1,6,Sunday,41,9.532062391681109,3,1
219,BHMBCCMKT01,577,26.14453614,91.73617216,57,car,low,2,1,16-10-2016,09:27:00,2016-10-16 09:27:00,2016-10-16,09:27:00,9,27,6,Sunday,41,9.878682842287695,3,1
220,BHMBCCMKT01,577,26.14453614,91.73617216,57,car,low,4,1,16-10-2016,10:04:00,2016-10-16 10:04:00,2016-10-16,10:04:00,10,4,6,Sunday,41,9.878682842287695,3,1
221,BHMBCCMKT01,577,26.14453614,91.73617216,56,bike,average,3,1,16-10-2016,10:34:00,2016-10-16 10:34:00,2016-10-16,10:34:00,10,34,6,Sunday,41,9.705372616984402,2,2
222,BHMBCCMKT01,577,26.14453614,91.73617216,56,bike,average,5,1,16-10-2016,11:01:00,2016-10-16 11:01:00,2016-10-16,11:01:00,11,1,6,Sunday,41,9.705372616984402,2,2
223,BHMBCCMKT01,577,26.14453614,91.73617216,56,truck,average,4,1,16-10-2016,11:27:00,2016-10-16 11:27:00,2016-10-16,11:27:00,11,27,6,Sunday,41,9.705372616984402,4,2
224,BHMBCCMKT01,577,26.14453614,91.73617216,65,car,high,8,1,16-10-2016,12:01:00,2016-10-16 12:01:00,2016-10-16,12:01:00,12,1,6,Sunday,41,11.265164644714037,3,3
225,BHMBCCMKT01,577,26.14453614,91.73617216,105,bike,high,9,1,16-10-2016,12:27:00,2016-10-16 12:27:00,2016-10-16,12:27:00,12,27,6,Sunday,41,18.19757365684575,2,3
226,BHMBCCMKT01,577,26.14453614,91.73617216,131,car,high,8,1,16-10-2016,13:01:00,2016-10-16 13:01:00,2016-10-16,13:01:00,13,1,6,Sunday,41,22.703639514731368,3,3
227,BHMBCCMKT01,577,26.14453614,91.73617216,146,car,average,6,1,16-10-2016,13:27:00,2016-10-16 13:27:00,2016-10-16,13:27:00,13,27,6,Sunday,41,25.30329289428076,3,2
228,BHMBCCMKT01,577,26.14453614,91.73617216,170,bike,high,7,1,16-10-2016,14:01:00,2016-10-16 14:01:00,2016-10-16,14:01:00,14,1,6,Sunday,41,29.462738301559792,2,3
229,BHMBCCMKT01,577,26.14453614,91.73617216,180,car,average,5,1,16-10-2016,14:27:00,2016-10-16 14:27:00,2016-10-16,14:27:00,14,27,6,Sunday,41,31.195840554592717,3,2
230,BHMBCCMKT01,577,26.14453614,91.73617216,192,car,low,3,1,16-10-2016,15:01:00,2016-10-16 15:01:00,2016-10-16,15:01:00,15,1,6,Sunday,41,33.27556325823224,3,1
231,BHMBCCMKT01,577,26.14453614,91.73617216,185,bike,low,3,1,16-10-2016,15:31:00,2016-10-16 15:31:00,2016-10-16,15:31:00,15,31,6,Sunday,41,32.06239168110919,2,1
232,BHMBCCMKT01,577,26.14453614,91.73617216,173,cycle,low,3,1,16-10-2016,15:57:00,2016-10-16 15:57:00,2016-10-16,15:57:00,15,57,6,Sunday,41,29.98266897746967,1,1
233,BHMBCCMKT01,577,26.14453614,91.73617216,154,car,average,3,1,16-10-2016,16:31:00,2016-10-16 16:31:00,2016-10-16,16:31:00,16,31,6,Sunday,41,26.689774696707108,3,2
234,BHMBCCMKT01,577,26.14453614,91.73617216,50,bike,low,2,0,17-10-2016,08:01:00,2016-10-17 08:01:00,2016-10-17,08:01:00,8,1,0,Monday,42,8.665511265164644,2,1
235,BHMBCCMKT01,577,26.14453614,91.73617216,54,bike,low,1,0,17-10-2016,08:27:00,2016-10-17 08:27:00,2016-10-17,08:27:00,8,27,0,Monday,42,9.358752166377817,2,1
236,BHMBCCMKT01,577,26.14453614,91.73617216,66,car,low,1,0,17-10-2016,09:01:00,2016-10-17 09:01:00,2016-10-17,09:01:00,9,1,0,Monday,42,11.438474870017332,3,1
237,BHMBCCMKT01,577,26.14453614,91.73617216,76,truck,low,2,0,17-10-2016,09:27:00,2016-10-17 09:27:00,2016-10-17,09:27:00,9,27,0,Monday,42,13.171577123050259,4,1
238,BHMBCCMKT01,577,26.14453614,91.73617216,112,car,average,3,0,17-10-2016,10:04:00,2016-10-17 10:04:00,2016-10-17,10:04:00,10,4,0,Monday,42,19.410745233968804,3,2
239,BHMBCCMKT01,577,26.14453614,91.73617216,119,bike,high,5,0,17-10-2016,10:31:00,2016-10-17 10:31:00,2016-10-17,10:31:00,10,31,0,Monday,42,20.623916811091856,2,3
240,BHMBCCMKT01,577,26.14453614,91.73617216,144,car,high,6,0,17-10-2016,11:04:00,2016-10-17 11:04:00,2016-10-17,11:04:00,11,4,0,Monday,42,24.956672443674176,3,3
241,BHMBCCMKT01,577,26.14453614,91.73617216,153,car,high,6,0,17-10-2016,11:31:00,2016-10-17 11:31:00,2016-10-17,11:31:00,11,31,0,Monday,42,26.51646447140381,3,3
242,BHMBCCMKT01,577,26.14453614,91.73617216,159,car,high,7,0,17-10-2016,12:04:00,2016-10-17 12:04:00,2016-10-17,12:04:00,12,4,0,Monday,42,27.55632582322357,3,3
243,BHMBCCMKT01,577,26.14453614,91.73617216,154,car,high,7,0,17-10-2016,12:31:00,2016-10-17 12:31:00,2016-10-17,12:31:00,12,31,0,Monday,42,26.689774696707108,3,3
244,BHMBCCMKT01,577,26.14453614,91.73617216,154,car,high,6,0,17-10-2016,12:57:00,2016-10-17 12:57:00,2016-10-17,12:57:00,12,57,0,Monday,42,26.689774696707108,3,3
245,BHMBCCMKT01,577,26.14453614,91.73617216,157,bike,high,6,0,17-10-2016,13:31:00,2016-10-17 13:31:00,2016-10-17,13:31:00,13,31,0,Monday,42,27.209705372616984,2,3
246,BHMBCCMKT01,577,26.14453614,91.73617216,161,car,average,3,0,17-10-2016,14:04:00,2016-10-17 14:04:00,2016-10-17,14:04:00,14,4,0,Monday,42,27.902946273830153,3,2
247,BHMBCCMKT01,577,26.14453614,91.73617216,147,car,high,4,0,17-10-2016,14:31:00,2016-10-17 14:31:00,2016-10-17,14:31:00,14,31,0,Monday,42,25.476603119584055,3,3
248,BHMBCCMKT01,577,26.14453614,91.73617216,133,bike,average,4,0,17-10-2016,14:57:00,2016-10-17 14:57:00,2016-10-17,14:57:00,14,57,0,Monday,42,23.050259965337954,2,2
249,BHMBCCMKT01,577,26.14453614,91.73617216,121,bike,low,2,0,17-10-2016,15:31:00,2016-10-17 15:31:00,2016-10-17,15:31:00,15,31,0,Monday,42,20.97053726169844,2,1
250,BHMBCCMKT01,577,26.14453614,91.73617216,115,car,low,1,0,17-10-2016,15:57:00,2016-10-17 15:57:00,2016-10-17,15:57:00,15,57,0,Monday,42,19.930675909878683,3,1
251,BHMBCCMKT01,577,26.14453614,91.73617216,110,truck,low,2,0,17-10-2016,16:28:00,2016-10-17 16:28:00,2016-10-17,16:28:00,16,28,0,Monday,42,19.064124783362217,4,1
252,BHMBCCMKT01,577,26.14453614,91.73617216,57,bike,low,2,0,18-10-2016,08:01:00,2016-10-18 08:01:00,2016-10-18,08:01:00,8,1,1,Tuesday,42,9.878682842287695,2,1
253,BHMBCCMKT01,577,26.14453614,91.73617216,60,car,low,2,0,18-10-2016,08:28:00,2016-10-18 08:28:00,2016-10-18,08:28:00,8,28,1,Tuesday,42,10.398613518197573,3,1
254,BHMBCCMKT01,577,26.14453614,91.73617216,72,car,low,1,0,18-10-2016,09:01:00,2016-10-18 09:01:00,2016-10-18,09:01:00,9,1,1,Tuesday,42,12.478336221837088,3,1
255,BHMBCCMKT01,577,26.14453614,91.73617216,91,bike,low,2,0,18-10-2016,09:28:00,2016-10-18 09:28:00,2016-10-18,09:28:00,9,28,1,Tuesday,42,15.771230502599654,2,1
256,BHMBCCMKT01,577,26.14453614,91.73617216,145,car,low,3,0,18-10-2016,10:01:00,2016-10-18 10:01:00,2016-10-18,10:01:00,10,1,1,Tuesday,42,25.12998266897747,3,1
257,BHMBCCMKT01,577,26.14453614,91.73617216,178,car,low,2,0,18-10-2016,10:28:00,2016-10-18 10:28:00,2016-10-18,10:28:00,10,28,1,Tuesday,42,30.849220103986134,3,1
258,BHMBCCMKT01,577,26.14453614,91.73617216,220,bike,average,5,0,18-10-2016,11:01:00,2016-10-18 11:01:00,2016-10-18,11:01:00,11,1,1,Tuesday,42,38.128249566724435,2,2
259,BHMBCCMKT01,577,26.14453614,91.73617216,228,car,average,5,0,18-10-2016,11:27:00,2016-10-18 11:27:00,2016-10-18,11:27:00,11,27,1,Tuesday,42,39.51473136915078,3,2
260,BHMBCCMKT01,577,26.14453614,91.73617216,231,cycle,high,7,0,18-10-2016,12:01:00,2016-10-18 12:01:00,2016-10-18,12:01:00,12,1,1,Tuesday,42,40.03466204506066,1,3
261,BHMBCCMKT01,577,26.14453614,91.73617216,224,truck,high,7,0,18-10-2016,12:27:00,2016-10-18 12:27:00,2016-10-18,12:27:00,12,27,1,Tuesday,42,38.82149046793761,4,3
262,BHMBCCMKT01,577,26.14453614,91.73617216,237,truck,high,6,0,18-10-2016,13:01:00,2016-10-18 13:01:00,2016-10-18,13:01:00,13,1,1,Tuesday,42,41.074523396880416,4,3
263,BHMBCCMKT01,577,26.14453614,91.73617216,227,car,high,6,0,18-10-2016,13:28:00,2016-10-18 13:28:00,2016-10-18,13:28:00,13,28,1,Tuesday,42,39.34142114384749,3,3
264,BHMBCCMKT01,577,26.14453614,91.73617216,226,bike,high,6,0,18-10-2016,13:54:00,2016-10-18 13:54:00,2016-10-18,13:54:00,13,54,1,Tuesday,42,39.168110918544194,2,3
265,BHMBCCMKT01,577,26.14453614,91.73617216,200,cycle,average,3,0,18-10-2016,14:27:00,2016-10-18 14:27:00,2016-10-18,14:27:00,14,27,1,Tuesday,42,34.66204506065858,1,2
266,BHMBCCMKT01,577,26.14453614,91.73617216,165,car,low,3,0,18-10-2016,15:01:00,2016-10-18 15:01:00,2016-10-18,15:01:00,15,1,1,Tuesday,42,28.596187175043326,3,1
267,BHMBCCMKT01,577,26.14453614,91.73617216,157,cycle,low,2,0,18-10-2016,15:27:00,2016-10-18 15:27:00,2016-10-18,15:27:00,15,27,1,Tuesday,42,27.209705372616984,1,1
268,BHMBCCMKT01,577,26.14453614,91.73617216,149,car,low,2,0,18-10-2016,15:55:00,2016-10-18 15:55:00,2016-10-18,15:55:00,15,55,1,Tuesday,42,25.82322357019064,3,1
269,BHMBCCMKT01,577,26.14453614,91.73617216,124,car,low,2,0,18-10-2016,16:27:00,2016-10-18 16:27:00,2016-10-18,16:27:00,16,27,1,Tuesday,42,21.49046793760832,3,1
270,BHMBCCMKT01,577,26.14453614,91.73617216,49,car,low,2,0,19-10-2016,08:05:00,2016-10-19 08:05:00,2016-10-19,08:05:00,8,5,2,Wednesday,42,8.492201039861353,3,1
271,BHMBCCMKT01,577,26.14453614,91.73617216,51,car,low,1,0,19-10-2016,08:25:00,2016-10-19 08:25:00,2016-10-19,08:25:00,8,25,2,Wednesday,42,8.838821490467938,3,1
272,BHMBCCMKT01,577,26.14453614,91.73617216,59,car,low,2,0,19-10-2016,08:58:00,2016-10-19 08:58:00,2016-10-19,08:58:00,8,58,2,Wednesday,42,10.22530329289428,3,1
273,BHMBCCMKT01,577,26.14453614,91.73617216,76,bike,low,2,0,19-10-2016,09:32:00,2016-10-19 09:32:00,2016-10-19,09:32:00,9,32,2,Wednesday,42,13.171577123050259,2,1
274,BHMBCCMKT01,577,26.14453614,91.73617216,105,car,low,2,0,19-10-2016,09:58:00,2016-10-19 09:58:00,2016-10-19,09:58:00,9,58,2,Wednesday,42,18.19757365684575,3,1
275,BHMBCCMKT01,577,26.14453614,91.73617216,135,car,low,3,0,19-10-2016,10:25:00,2016-10-19 10:25:00,2016-10-19,10:25:00,10,25,2,Wednesday,42,23.39688041594454,3,1
276,BHMBCCMKT01,577,26.14453614,91.73617216,156,car,average,3,0,19-10-2016,10:59:00,2016-10-19 10:59:00,2016-10-19,10:59:00,10,59,2,Wednesday,42,27.03639514731369,3,2
277,BHMBCCMKT01,577,26.14453614,91.73617216,177,car,average,4,0,19-10-2016,11:25:00,2016-10-19 11:25:00,2016-10-19,11:25:00,11,25,2,Wednesday,42,30.675909878682845,3,2
278,BHMBCCMKT01,577,26.14453614,91.73617216,181,car,high,6,0,19-10-2016,11:59:00,2016-10-19 11:59:00,2016-10-19,11:59:00,11,59,2,Wednesday,42,31.369150779896017,3,3
279,BHMBCCMKT01,577,26.14453614,91.73617216,171,cycle,high,7,0,19-10-2016,12:25:00,2016-10-19 12:25:00,2016-10-19,12:25:00,12,25,2,Wednesday,42,29.636048526863085,1,3
280,BHMBCCMKT01,577,26.14453614,91.73617216,165,car,high,7,0,19-10-2016,12:58:00,2016-10-19 12:58:00,2016-10-19,12:58:00,12,58,2,Wednesday,42,28.596187175043326,3,3
281,BHMBCCMKT01,577,26.14453614,91.73617216,167,bike,high,6,0,19-10-2016,13:25:00,2016-10-19 13:25:00,2016-10-19,13:25:00,13,25,2,Wednesday,42,28.942807625649912,2,3
282,BHMBCCMKT01,577,26.14453614,91.73617216,161,car,average,5,0,19-10-2016,13:58:00,2016-10-19 13:58:00,2016-10-19,13:58:00,13,58,2,Wednesday,42,27.902946273830153,3,2
283,BHMBCCMKT01,577,26.14453614,91.73617216,156,car,average,3,0,19-10-2016,14:32:00,2016-10-19 14:32:00,2016-10-19,14:32:00,14,32,2,Wednesday,42,27.03639514731369,3,2
284,BHMBCCMKT01,577,26.14453614,91.73617216,144,cycle,average,4,0,19-10-2016,14:58:00,2016-10-19 14:58:00,2016-10-19,14:58:00,14,58,2,Wednesday,42,24.956672443674176,1,2
285,BHMBCCMKT01,577,26.14453614,91.73617216,127,car,low,1,0,19-10-2016,15:32:00,2016-10-19 15:32:00,2016-10-19,15:32:00,15,32,2,Wednesday,42,22.0103986135182,3,1
286,BHMBCCMKT01,577,26.14453614,91.73617216,117,bike,low,2,0,19-10-2016,15:59:00,2016-10-19 15:59:00,2016-10-19,15:59:00,15,59,2,Wednesday,42,20.27729636048527,2,1
287,BHMBCCMKT01,577,26.14453614,91.73617216,110,car,low,2,0,19-10-2016,16:25:00,2016-10-19 16:25:00,2016-10-19,16:25:00,16,25,2,Wednesday,42,19.064124783362217,3,1
288,BHMBCCMKT01,577,26.14453614,91.73617216,57,truck,average,2,0,22-10-2016,07:59:00,2016-10-22 07:59:00,2016-10-22,07:59:00,7,59,5,Saturday,42,9.878682842287695,4,2
289,BHMBCCMKT01,577,26.14453614,91.73617216,59,car,average,1,0,22-10-2016,08:26:00,2016-10-22 08:26:00,2016-10-22,08:26:00,8,26,5,Saturday,42,10.22530329289428,3,2
290,BHMBCCMKT01,577,26.14453614,91.73617216,72,truck,low,1,0,22-10-2016,08:59:00,2016-10-22 08:59:00,2016-10-22,08:59:00,8,59,5,Saturday,42,12.478336221837088,4,1
291,BHMBCCMKT01,577,26.14453614,91.73617216,93,car,low,2,0,22-10-2016,09:26:00,2016-10-22 09:26:00,2016-10-22,09:26:00,9,26,5,Saturday,42,16.11785095320624,3,1
292,BHMBCCMKT01,577,26.14453614,91.73617216,130,car,low,2,0,22-10-2016,09:59:00,2016-10-22 09:59:00,2016-10-22,09:59:00,9,59,5,Saturday,42,22.530329289428074,3,1
293,BHMBCCMKT01,577,26.14453614,91.73617216,156,car,low,3,0,22-10-2016,10:26:00,2016-10-22 10:26:00,2016-10-22,10:26:00,10,26,5,Saturday,42,27.03639514731369,3,1
294,BHMBCCMKT01,577,26.14453614,91.73617216,198,truck,average,4,0,22-10-2016,10:59:00,2016-10-22 10:59:00,2016-10-22,10:59:00,10,59,5,Saturday,42,34.31542461005199,4,2
295,BHMBCCMKT01,577,26.14453614,91.73617216,239,car,average,4,0,22-10-2016,11:32:00,2016-10-22 11:32:00,2016-10-22,11:32:00,11,32,5,Saturday,42,41.421143847487,3,2
296,BHMBCCMKT01,577,26.14453614,91.73617216,261,car,average,5,0,22-10-2016,11:59:00,2016-10-22 11:59:00,2016-10-22,11:59:00,11,59,5,Saturday,42,45.233968804159446,3,2
297,BHMBCCMKT01,577,26.14453614,91.73617216,324,car,high,8,0,22-10-2016,12:32:00,2016-10-22 12:32:00,2016-10-22,12:32:00,12,32,5,Saturday,42,56.1525129982669,3,3
298,BHMBCCMKT01,577,26.14453614,91.73617216,359,car,high,8,0,22-10-2016,12:59:00,2016-10-22 12:59:00,2016-10-22,12:59:00,12,59,5,Saturday,42,62.218370883882145,3,3
299,BHMBCCMKT01,577,26.14453614,91.73617216,380,cycle,high,7,0,22-10-2016,13:32:00,2016-10-22 13:32:00,2016-10-22,13:32:00,13,32,5,Saturday,42,65.8578856152513,1,3
300,BHMBCCMKT01,577,26.14453614,91.73617216,408,bike,average,5,0,22-10-2016,13:59:00,2016-10-22 13:59:00,2016-10-22,13:59:00,13,59,5,Saturday,42,70.7105719237435,2,2
301,BHMBCCMKT01,577,26.14453614,91.73617216,430,truck,average,4,0,22-10-2016,14:39:00,2016-10-22 14:39:00,2016-10-22,14:39:00,14,39,5,Saturday,42,74.52339688041594,4,2
302,BHMBCCMKT01,577,26.14453614,91.73617216,424,bike,average,4,0,22-10-2016,14:59:00,2016-10-22 14:59:00,2016-10-22,14:59:00,14,59,5,Saturday,42,73.48353552859619,2,2
303,BHMBCCMKT01,577,26.14453614,91.73617216,403,car,low,3,0,22-10-2016,15:26:00,2016-10-22 15:26:00,2016-10-22,15:26:00,15,26,5,Saturday,42,69.84402079722703,3,1
304,BHMBCCMKT01,577,26.14453614,91.73617216,384,car,low,2,0,22-10-2016,15:59:00,2016-10-22 15:59:00,2016-10-22,15:59:00,15,59,5,Saturday,42,66.55112651646448,3,1
305,BHMBCCMKT01,577,26.14453614,91.73617216,340,car,low,2,0,22-10-2016,16:26:00,2016-10-22 16:26:00,2016-10-22,16:26:00,16,26,5,Saturday,42,58.925476603119584,3,1
306,BHMBCCMKT01,577,26.14453614,91.73617216,47,car,low,2,1,23-10-2016,07:59:00,2016-10-23 07:59:00,2016-10-23,07:59:00,7,59,6,Sunday,42,8.145580589254767,3,1
307,BHMBCCMKT01,577,26.14453614,91.73617216,48,bike,low,2,1,23-10-2016,08:26:00,2016-10-23 08:26:00,2016-10-23,08:26:00,8,26,6,Sunday,42,8.31889081455806,2,1
308,BHMBCCMKT01,577,26.14453614,91.73617216,51,car,average,2,1,23-10-2016,08:59:00,2016-10-23 08:59:00,2016-10-23,08:59:00,8,59,6,Sunday,42,8.838821490467938,3,2
309,BHMBCCMKT01,577,26.14453614,91.73617216,50,car,average,3,1,23-10-2016,09:26:00,2016-10-23 09:26:00,2016-10-23,09:26:00,9,26,6,Sunday,42,8.665511265164644,3,2
310,BHMBCCMKT01,577,26.14453614,91.73617216,54,car,average,3,1,23-10-2016,09:59:00,2016-10-23 09:59:00,2016-10-23,09:59:00,9,59,6,Sunday,42,9.358752166377817,3,2
311,BHMBCCMKT01,577,26.14453614,91.73617216,60,car,low,3,1,23-10-2016,10:26:00,2016-10-23 10:26:00,2016-10-23,10:26:00,10,26,6,Sunday,42,10.398613518197573,3,1
312,BHMBCCMKT01,577,26.14453614,91.73617216,80,truck,average,4,1,23-10-2016,10:59:00,2016-10-23 10:59:00,2016-10-23,10:59:00,10,59,6,Sunday,42,13.864818024263432,4,2
313,BHMBCCMKT01,577,26.14453614,91.73617216,107,car,average,6,1,23-10-2016,11:26:00,2016-10-23 11:26:00,2016-10-23,11:26:00,11,26,6,Sunday,42,18.544194107452338,3,2
314,BHMBCCMKT01,577,26.14453614,91.73617216,125,truck,average,6,1,23-10-2016,11:59:00,2016-10-23 11:59:00,2016-10-23,11:59:00,11,59,6,Sunday,42,21.663778162911612,4,2
315,BHMBCCMKT01,577,26.14453614,91.73617216,144,cycle,high,9,1,23-10-2016,12:26:00,2016-10-23 12:26:00,2016-10-23,12:26:00,12,26,6,Sunday,42,24.956672443674176,1,3
316,BHMBCCMKT01,577,26.14453614,91.73617216,175,truck,high,9,1,23-10-2016,13:06:00,2016-10-23 13:06:00,2016-10-23,13:06:00,13,6,6,Sunday,42,30.329289428076255,4,3
317,BHMBCCMKT01,577,26.14453614,91.73617216,192,bike,high,9,1,23-10-2016,13:26:00,2016-10-23 13:26:00,2016-10-23,13:26:00,13,26,6,Sunday,42,33.27556325823224,2,3
318,BHMBCCMKT01,577,26.14453614,91.73617216,215,car,average,7,1,23-10-2016,13:59:00,2016-10-23 13:59:00,2016-10-23,13:59:00,13,59,6,Sunday,42,37.26169844020797,3,2
319,BHMBCCMKT01,577,26.14453614,91.73617216,226,car,average,5,1,23-10-2016,14:26:00,2016-10-23 14:26:00,2016-10-23,14:26:00,14,26,6,Sunday,42,39.168110918544194,3,2
320,BHMBCCMKT01,577,26.14453614,91.73617216,219,car,average,5,1,23-10-2016,14:59:00,2016-10-23 14:59:00,2016-10-23,14:59:00,14,59,6,Sunday,42,37.954939341421145,3,2
321,BHMBCCMKT01,577,26.14453614,91.73617216,215,truck,low,3,1,23-10-2016,15:26:00,2016-10-23 15:26:00,2016-10-23,15:26:00,15,26,6,Sunday,42,37.26169844020797,4,1
322,BHMBCCMKT01,577,26.14453614,91.73617216,179,car,low,3,1,23-10-2016,15:59:00,2016-10-23 15:59:00,2016-10-23,15:59:00,15,59,6,Sunday,42,31.022530329289427,3,1
323,BHMBCCMKT01,577,26.14453614,91.73617216,150,car,low,3,1,23-10-2016,16:26:00,2016-10-23 16:26:00,2016-10-23,16:26:00,16,26,6,Sunday,42,25.99653379549394,3,1
324,BHMBCCMKT01,577,26.14453614,91.73617216,47,car,low,1,0,24-10-2016,07:56:00,2016-10-24 07:56:00,2016-10-24,07:56:00,7,56,0,Monday,43,8.145580589254767,3,1
325,BHMBCCMKT01,577,26.14453614,91.73617216,55,car,low,1,0,24-10-2016,08:29:00,2016-10-24 08:29:00,2016-10-24,08:29:00,8,29,0,Monday,43,9.532062391681109,3,1
326,BHMBCCMKT01,577,26.14453614,91.73617216,62,car,low,2,0,24-10-2016,09:03:00,2016-10-24 09:03:00,2016-10-24,09:03:00,9,3,0,Monday,43,10.74523396880416,3,1
327,BHMBCCMKT01,577,26.14453614,91.73617216,73,truck,low,2,0,24-10-2016,09:30:00,2016-10-24 09:30:00,2016-10-24,09:30:00,9,30,0,Monday,43,12.65164644714038,4,1
328,BHMBCCMKT01,577,26.14453614,91.73617216,87,car,average,2,0,24-10-2016,09:55:00,2016-10-24 09:55:00,2016-10-24,09:55:00,9,55,0,Monday,43,15.077989601386482,3,2
329,BHMBCCMKT01,577,26.14453614,91.73617216,114,car,average,3,0,24-10-2016,10:30:00,2016-10-24 10:30:00,2016-10-24,10:30:00,10,30,0,Monday,43,19.75736568457539,3,2
330,BHMBCCMKT01,577,26.14453614,91.73617216,137,car,average,4,0,24-10-2016,11:03:00,2016-10-24 11:03:00,2016-10-24,11:03:00,11,3,0,Monday,43,23.743500866551127,3,2
331,BHMBCCMKT01,577,26.14453614,91.73617216,155,car,average,4,0,24-10-2016,11:29:00,2016-10-24 11:29:00,2016-10-24,11:29:00,11,29,0,Monday,43,26.8630849220104,3,2
332,BHMBCCMKT01,577,26.14453614,91.73617216,173,bike,high,7,0,24-10-2016,12:02:00,2016-10-24 12:02:00,2016-10-24,12:02:00,12,2,0,Monday,43,29.98266897746967,2,3
333,BHMBCCMKT01,577,26.14453614,91.73617216,191,truck,high,7,0,24-10-2016,12:30:00,2016-10-24 12:30:00,2016-10-24,12:30:00,12,30,0,Monday,43,33.10225303292894,4,3
334,BHMBCCMKT01,577,26.14453614,91.73617216,198,car,high,7,0,24-10-2016,12:56:00,2016-10-24 12:56:00,2016-10-24,12:56:00,12,56,0,Monday,43,34.31542461005199,3,3
335,BHMBCCMKT01,577,26.14453614,91.73617216,208,car,high,6,0,24-10-2016,13:30:00,2016-10-24 13:30:00,2016-10-24,13:30:00,13,30,0,Monday,43,36.04852686308492,3,3
336,BHMBCCMKT01,577,26.14453614,91.73617216,219,car,average,4,0,24-10-2016,13:56:00,2016-10-24 13:56:00,2016-10-24,13:56:00,13,56,0,Monday,43,37.954939341421145,3,2
337,BHMBCCMKT01,577,26.14453614,91.73617216,215,truck,average,3,0,24-10-2016,14:30:00,2016-10-24 14:30:00,2016-10-24,14:30:00,14,30,0,Monday,43,37.26169844020797,4,2
338,BHMBCCMKT01,577,26.14453614,91.73617216,209,car,average,4,0,24-10-2016,14:56:00,2016-10-24 14:56:00,2016-10-24,14:56:00,14,56,0,Monday,43,36.22183708838821,3,2
339,BHMBCCMKT01,577,26.14453614,91.73617216,209,car,low,2,0,24-10-2016,15:32:00,2016-10-24 15:32:00,2016-10-24,15:32:00,15,32,0,Monday,43,36.22183708838821,3,1
340,BHMBCCMKT01,577,26.14453614,91.73617216,192,car,low,1,0,24-10-2016,16:00:00,2016-10-24 16:00:00,2016-10-24,16:00:00,16,0,0,Monday,43,33.27556325823224,3,1
341,BHMBCCMKT01,577,26.14453614,91.73617216,175,bike,average,2,0,24-10-2016,16:33:00,2016-10-24 16:33:00,2016-10-24,16:33:00,16,33,0,Monday,43,30.329289428076255,2,2
342,BHMBCCMKT01,577,26.14453614,91.73617216,54,bike,low,1,0,25-10-2016,08:00:00,2016-10-25 08:00:00,2016-10-25,08:00:00,8,0,1,Tuesday,43,9.358752166377817,2,1
343,BHMBCCMKT01,577,26.14453614,91.73617216,55,car,low,1,0,25-10-2016,08:26:00,2016-10-25 08:26:00,2016-10-25,08:26:00,8,26,1,Tuesday,43,9.532062391681109,3,1
344,BHMBCCMKT01,577,26.14453614,91.73617216,82,truck,low,2,0,25-10-2016,09:00:00,2016-10-25 09:00:00,2016-10-25,09:00:00,9,0,1,Tuesday,43,14.211438474870016,4,1
345,BHMBCCMKT01,577,26.14453614,91.73617216,95,car,low,2,0,25-10-2016,09:19:00,2016-10-25 09:19:00,2016-10-25,09:19:00,9,19,1,Tuesday,43,16.464471403812826,3,1
346,BHMBCCMKT01,577,26.14453614,91.73617216,129,car,low,1,0,25-10-2016,09:56:00,2016-10-25 09:56:00,2016-10-25,09:56:00,9,56,1,Tuesday,43,22.357019064124785,3,1
347,BHMBCCMKT01,577,26.14453614,91.73617216,173,car,low,2,0,25-10-2016,10:29:00,2016-10-25 10:29:00,2016-10-25,10:29:00,10,29,1,Tuesday,43,29.98266897746967,3,1
348,BHMBCCMKT01,577,26.14453614,91.73617216,202,car,average,3,0,25-10-2016,10:56:00,2016-10-25 10:56:00,2016-10-25,10:56:00,10,56,1,Tuesday,43,35.008665511265164,3,2
349,BHMBCCMKT01,577,26.14453614,91.73617216,249,bike,average,5,0,25-10-2016,11:29:00,2016-10-25 11:29:00,2016-10-25,11:29:00,11,29,1,Tuesday,43,43.154246100519934,2,2
350,BHMBCCMKT01,577,26.14453614,91.73617216,290,bike,high,8,0,25-10-2016,12:02:00,2016-10-25 12:02:00,2016-10-25,12:02:00,12,2,1,Tuesday,43,50.25996533795494,2,3
351,BHMBCCMKT01,577,26.14453614,91.73617216,303,car,high,8,0,25-10-2016,12:29:00,2016-10-25 12:29:00,2016-10-25,12:29:00,12,29,1,Tuesday,43,52.512998266897746,3,3
352,BHMBCCMKT01,577,26.14453614,91.73617216,331,bike,average,5,0,25-10-2016,13:03:00,2016-10-25 13:03:00,2016-10-25,13:03:00,13,3,1,Tuesday,43,57.36568457538995,2,2
353,BHMBCCMKT01,577,26.14453614,91.73617216,345,car,high,7,0,25-10-2016,13:29:00,2016-10-25 13:29:00,2016-10-25,13:29:00,13,29,1,Tuesday,43,59.79202772963605,3,3
354,BHMBCCMKT01,577,26.14453614,91.73617216,363,truck,average,5,0,25-10-2016,13:56:00,2016-10-25 13:56:00,2016-10-25,13:56:00,13,56,1,Tuesday,43,62.911611785095324,4,2
355,BHMBCCMKT01,577,26.14453614,91.73617216,365,bike,average,4,0,25-10-2016,14:29:00,2016-10-25 14:29:00,2016-10-25,14:29:00,14,29,1,Tuesday,43,63.258232235701904,2,2
356,BHMBCCMKT01,577,26.14453614,91.73617216,340,cycle,average,3,0,25-10-2016,15:02:00,2016-10-25 15:02:00,2016-10-25,15:02:00,15,2,1,Tuesday,43,58.925476603119584,1,2
357,BHMBCCMKT01,577,26.14453614,91.73617216,302,bike,low,2,0,25-10-2016,15:29:00,2016-10-25 15:29:00,2016-10-25,15:29:00,15,29,1,Tuesday,43,52.33968804159446,2,1
358,BHMBCCMKT01,577,26.14453614,91.73617216,273,cycle,low,2,0,25-10-2016,15:56:00,2016-10-25 15:56:00,2016-10-25,15:56:00,15,56,1,Tuesday,43,47.313691507798964,1,1
359,BHMBCCMKT01,577,26.14453614,91.73617216,226,car,low,2,0,25-10-2016,16:29:00,2016-10-25 16:29:00,2016-10-25,16:29:00,16,29,1,Tuesday,43,39.168110918544194,3,1
360,BHMBCCMKT01,577,26.14453614,91.73617216,56,bike,low,1,0,26-10-2016,07:59:00,2016-10-26 07:59:00,2016-10-26,07:59:00,7,59,2,Wednesday,43,9.705372616984402,2,1
361,BHMBCCMKT01,577,26.14453614,91.73617216,63,truck,low,2,0,26-10-2016,08:32:00,2016-10-26 08:32:00,2016-10-26,08:32:00,8,32,2,Wednesday,43,10.918544194107453,4,1
362,BHMBCCMKT01,577,26.14453614,91.73617216,70,car,low,1,0,26-10-2016,08:59:00,2016-10-26 08:59:00,2016-10-26,08:59:00,8,59,2,Wednesday,43,12.131715771230503,3,1
363,BHMBCCMKT01,577,26.14453614,91.73617216,87,car,average,2,0,26-10-2016,09:26:00,2016-10-26 09:26:00,2016-10-26,09:26:00,9,26,2,Wednesday,43,15.077989601386482,3,2
364,BHMBCCMKT01,577,26.14453614,91.73617216,108,car,low,2,0,26-10-2016,09:59:00,2016-10-26 09:59:00,2016-10-26,09:59:00,9,59,2,Wednesday,43,18.717504332755635,3,1
365,BHMBCCMKT01,577,26.14453614,91.73617216,125,bike,low,2,0,26-10-2016,10:26:00,2016-10-26 10:26:00,2016-10-26,10:26:00,10,26,2,Wednesday,43,21.663778162911612,2,1
366,BHMBCCMKT01,577,26.14453614,91.73617216,159,car,average,3,0,26-10-2016,10:59:00,2016-10-26 10:59:00,2016-10-26,10:59:00,10,59,2,Wednesday,43,27.55632582322357,3,2
367,BHMBCCMKT01,577,26.14453614,91.73617216,182,car,average,4,0,26-10-2016,11:26:00,2016-10-26 11:26:00,2016-10-26,11:26:00,11,26,2,Wednesday,43,31.542461005199307,3,2
368,BHMBCCMKT01,577,26.14453614,91.73617216,198,car,average,5,0,26-10-2016,11:59:00,2016-10-26 11:59:00,2016-10-26,11:59:00,11,59,2,Wednesday,43,34.31542461005199,3,2
369,BHMBCCMKT01,577,26.14453614,91.73617216,205,bike,high,7,0,26-10-2016,12:26:00,2016-10-26 12:26:00,2016-10-26,12:26:00,12,26,2,Wednesday,43,35.52859618717504,2,3
370,BHMBCCMKT01,577,26.14453614,91.73617216,231,cycle,high,7,0,26-10-2016,12:59:00,2016-10-26 12:59:00,2016-10-26,12:59:00,12,59,2,Wednesday,43,40.03466204506066,1,3
371,BHMBCCMKT01,577,26.14453614,91.73617216,244,car,high,7,0,26-10-2016,13:26:00,2016-10-26 13:26:00,2016-10-26,13:26:00,13,26,2,Wednesday,43,42.287694974003465,3,3
372,BHMBCCMKT01,577,26.14453614,91.73617216,260,car,average,5,0,26-10-2016,13:59:00,2016-10-26 13:59:00,2016-10-26,13:59:00,13,59,2,Wednesday,43,45.06065857885615,3,2
373,BHMBCCMKT01,577,26.14453614,91.73617216,267,car,average,4,0,26-10-2016,14:26:00,2016-10-26 14:26:00,2016-10-26,14:26:00,14,26,2,Wednesday,43,46.2738301559792,3,2
374,BHMBCCMKT01,577,26.14453614,91.73617216,252,car,average,4,0,26-10-2016,14:59:00,2016-10-26 14:59:00,2016-10-26,14:59:00,14,59,2,Wednesday,43,43.67417677642981,3,2
375,BHMBCCMKT01,577,26.14453614,91.73617216,238,cycle,low,2,0,26-10-2016,15:26:00,2016-10-26 15:26:00,2016-10-26,15:26:00,15,26,2,Wednesday,43,41.24783362218371,1,1
376,BHMBCCMKT01,577,26.14453614,91.73617216,212,bike,low,2,0,26-10-2016,15:59:00,2016-10-26 15:59:00,2016-10-26,15:59:00,15,59,2,Wednesday,43,36.741767764298096,2,1
377,BHMBCCMKT01,577,26.14453614,91.73617216,180,car,low,2,0,26-10-2016,16:32:00,2016-10-26 16:32:00,2016-10-26,16:32:00,16,32,2,Wednesday,43,31.195840554592717,3,1
378,BHMBCCMKT01,577,26.14453614,91.73617216,54,cycle,low,2,0,27-10-2016,07:59:00,2016-10-27 07:59:00,2016-10-27,07:59:00,7,59,3,Thursday,43,9.358752166377817,1,1
379,BHMBCCMKT01,577,26.14453614,91.73617216,60,car,average,1,0,27-10-2016,08:32:00,2016-10-27 08:32:00,2016-10-27,08:32:00,8,32,3,Thursday,43,10.398613518197573,3,2
380,BHMBCCMKT01,577,26.14453614,91.73617216,69,car,low,1,0,27-10-2016,08:59:00,2016-10-27 08:59:00,2016-10-27,08:59:00,8,59,3,Thursday,43,11.95840554592721,3,1
381,BHMBCCMKT01,577,26.14453614,91.73617216,90,car,low,2,0,27-10-2016,09:32:00,2016-10-27 09:32:00,2016-10-27,09:32:00,9,32,3,Thursday,43,15.597920277296359,3,1
382,BHMBCCMKT01,577,26.14453614,91.73617216,102,truck,average,2,0,27-10-2016,09:59:00,2016-10-27 09:59:00,2016-10-27,09:59:00,9,59,3,Thursday,43,17.677642980935875,4,2
383,BHMBCCMKT01,577,26.14453614,91.73617216,117,bike,average,3,0,27-10-2016,10:25:00,2016-10-27 10:25:00,2016-10-27,10:25:00,10,25,3,Thursday,43,20.27729636048527,2,2
384,BHMBCCMKT01,577,26.14453614,91.73617216,160,bike,average,3,0,27-10-2016,10:59:00,2016-10-27 10:59:00,2016-10-27,10:59:00,10,59,3,Thursday,43,27.729636048526864,2,2
385,BHMBCCMKT01,577,26.14453614,91.73617216,189,car,average,5,0,27-10-2016,11:32:00,2016-10-27 11:32:00,2016-10-27,11:32:00,11,32,3,Thursday,43,32.755632582322356,3,2
386,BHMBCCMKT01,577,26.14453614,91.73617216,207,cycle,high,7,0,27-10-2016,11:59:00,2016-10-27 11:59:00,2016-10-27,11:59:00,11,59,3,Thursday,43,35.875216637781634,1,3
387,BHMBCCMKT01,577,26.14453614,91.73617216,222,car,high,8,0,27-10-2016,12:26:00,2016-10-27 12:26:00,2016-10-27,12:26:00,12,26,3,Thursday,43,38.47487001733102,3,3
388,BHMBCCMKT01,577,26.14453614,91.73617216,247,car,average,5,0,27-10-2016,12:59:00,2016-10-27 12:59:00,2016-10-27,12:59:00,12,59,3,Thursday,43,42.80762564991335,3,2
389,BHMBCCMKT01,577,26.14453614,91.73617216,271,car,high,7,0,27-10-2016,13:32:00,2016-10-27 13:32:00,2016-10-27,13:32:00,13,32,3,Thursday,43,46.96707105719237,3,3
390,BHMBCCMKT01,577,26.14453614,91.73617216,279,car,average,5,0,27-10-2016,13:59:00,2016-10-27 13:59:00,2016-10-27,13:59:00,13,59,3,Thursday,43,48.353552859618716,3,2
391,BHMBCCMKT01,577,26.14453614,91.73617216,280,truck,average,4,0,27-10-2016,14:26:00,2016-10-27 14:26:00,2016-10-27,14:26:00,14,26,3,Thursday,43,48.52686308492201,4,2
392,BHMBCCMKT01,577,26.14453614,91.73617216,266,bike,average,3,0,27-10-2016,14:59:00,2016-10-27 14:59:00,2016-10-27,14:59:00,14,59,3,Thursday,43,46.10051993067591,2,2
393,BHMBCCMKT01,577,26.14453614,91.73617216,263,car,low,3,0,27-10-2016,15:26:00,2016-10-27 15:26:00,2016-10-27,15:26:00,15,26,3,Thursday,43,45.58058925476603,3,1
394,BHMBCCMKT01,577,26.14453614,91.73617216,241,car,low,3,0,27-10-2016,15:59:00,2016-10-27 15:59:00,2016-10-27,15:59:00,15,59,3,Thursday,43,41.76776429809358,3,1
395,BHMBCCMKT01,577,26.14453614,91.73617216,225,truck,low,2,0,27-10-2016,16:26:00,2016-10-27 16:26:00,2016-10-27,16:26:00,16,26,3,Thursday,43,38.9948006932409,4,1
396,BHMBCCMKT01,577,26.14453614,91.73617216,57,car,low,1,0,28-10-2016,08:16:00,2016-10-28 08:16:00,2016-10-28,08:16:00,8,16,4,Friday,43,9.878682842287695,3,1
397,BHMBCCMKT01,577,26.14453614,91.73617216,57,car,low,2,0,28-10-2016,08:16:00,2016-10-28 08:16:00,2016-10-28,08:16:00,8,16,4,Friday,43,9.878682842287695,3,1
398,BHMBCCMKT01,577,26.14453614,91.73617216,69,car,low,1,0,28-10-2016,08:56:00,2016-10-28 08:56:00,2016-10-28,08:56:00,8,56,4,Friday,43,11.95840554592721,3,1
399,BHMBCCMKT01,577,26.14453614,91.73617216,99,bike,low,2,0,28-10-2016,09:29:00,2016-10-28 09:29:00,2016-10-28,09:29:00,9,29,4,Friday,43,17.157712305025996,2,1
400,BHMBCCMKT01,577,26.14453614,91.73617216,135,car,low,2,0,28-10-2016,10:02:00,2016-10-28 10:02:00,2016-10-28,10:02:00,10,2,4,Friday,43,23.39688041594454,3,1
401,BHMBCCMKT01,577,26.14453614,91.73617216,171,car,low,3,0,28-10-2016,10:29:00,2016-10-28 10:29:00,2016-10-28,10:29:00,10,29,4,Friday,43,29.636048526863085,3,1
402,BHMBCCMKT01,577,26.14453614,91.73617216,196,car,average,4,0,28-10-2016,10:56:00,2016-10-28 10:56:00,2016-10-28,10:56:00,10,56,4,Friday,43,33.96880415944541,3,2
403,BHMBCCMKT01,577,26.14453614,91.73617216,230,car,average,5,0,28-10-2016,11:29:00,2016-10-28 11:29:00,2016-10-28,11:29:00,11,29,4,Friday,43,39.86135181975737,3,2
404,BHMBCCMKT01,577,26.14453614,91.73617216,262,bike,average,5,0,28-10-2016,12:02:00,2016-10-28 12:02:00,2016-10-28,12:02:00,12,2,4,Friday,43,45.407279029462735,2,2
405,BHMBCCMKT01,577,26.14453614,91.73617216,269,car,high,8,0,28-10-2016,12:29:00,2016-10-28 12:29:00,2016-10-28,12:29:00,12,29,4,Friday,43,46.62045060658579,3,3
406,BHMBCCMKT01,577,26.14453614,91.73617216,266,car,high,6,0,28-10-2016,13:02:00,2016-10-28 13:02:00,2016-10-28,13:02:00,13,2,4,Friday,43,46.10051993067591,3,3
407,BHMBCCMKT01,577,26.14453614,91.73617216,275,car,high,7,0,28-10-2016,13:29:00,2016-10-28 13:29:00,2016-10-28,13:29:00,13,29,4,Friday,43,47.66031195840554,3,3
408,BHMBCCMKT01,577,26.14453614,91.73617216,296,bike,high,5,0,28-10-2016,14:02:00,2016-10-28 14:02:00,2016-10-28,14:02:00,14,2,4,Friday,43,51.2998266897747,2,3
409,BHMBCCMKT01,577,26.14453614,91.73617216,290,car,high,5,0,28-10-2016,14:29:00,2016-10-28 14:29:00,2016-10-28,14:29:00,14,29,4,Friday,43,50.25996533795494,3,3
410,BHMBCCMKT01,577,26.14453614,91.73617216,282,cycle,low,2,0,28-10-2016,15:02:00,2016-10-28 15:02:00,2016-10-28,15:02:00,15,2,4,Friday,43,48.87348353552859,1,1
411,BHMBCCMKT01,577,26.14453614,91.73617216,269,car,low,2,0,28-10-2016,15:29:00,2016-10-28 15:29:00,2016-10-28,15:29:00,15,29,4,Friday,43,46.62045060658579,3,1
412,BHMBCCMKT01,577,26.14453614,91.73617216,256,car,low,1,0,28-10-2016,16:02:00,2016-10-28 16:02:00,2016-10-28,16:02:00,16,2,4,Friday,43,44.367417677642976,3,1
413,BHMBCCMKT01,577,26.14453614,91.73617216,220,car,low,2,0,28-10-2016,16:29:00,2016-10-28 16:29:00,2016-10-28,16:29:00,16,29,4,Friday,43,38.128249566724435,3,1
414,BHMBCCMKT01,577,26.14453614,91.73617216,51,car,low,1,0,29-10-2016,07:59:00,2016-10-29 07:59:00,2016-10-29,07:59:00,7,59,5,Saturday,43,8.838821490467938,3,1
415,BHMBCCMKT01,577,26.14453614,91.73617216,56,car,low,1,0,29-10-2016,08:26:00,2016-10-29 08:26:00,2016-10-29,08:26:00,8,26,5,Saturday,43,9.705372616984402,3,1
416,BHMBCCMKT01,577,26.14453614,91.73617216,66,car,low,2,0,29-10-2016,08:59:00,2016-10-29 08:59:00,2016-10-29,08:59:00,8,59,5,Saturday,43,11.438474870017332,3,1
417,BHMBCCMKT01,577,26.14453614,91.73617216,91,car,low,2,0,29-10-2016,09:26:00,2016-10-29 09:26:00,2016-10-29,09:26:00,9,26,5,Saturday,43,15.771230502599654,3,1
418,BHMBCCMKT01,577,26.14453614,91.73617216,124,car,low,2,0,29-10-2016,09:59:00,2016-10-29 09:59:00,2016-10-29,09:59:00,9,59,5,Saturday,43,21.49046793760832,3,1
419,BHMBCCMKT01,577,26.14453614,91.73617216,164,bike,low,3,0,29-10-2016,10:26:00,2016-10-29 10:26:00,2016-10-29,10:26:00,10,26,5,Saturday,43,28.422876949740033,2,1
420,BHMBCCMKT01,577,26.14453614,91.73617216,213,car,average,4,0,29-10-2016,10:59:00,2016-10-29 10:59:00,2016-10-29,10:59:00,10,59,5,Saturday,43,36.915077989601386,3,2
421,BHMBCCMKT01,577,26.14453614,91.73617216,267,cycle,average,5,0,29-10-2016,11:25:00,2016-10-29 11:25:00,2016-10-29,11:25:00,11,25,5,Saturday,43,46.2738301559792,1,2
422,BHMBCCMKT01,577,26.14453614,91.73617216,314,bike,average,5,0,29-10-2016,12:06:00,2016-10-29 12:06:00,2016-10-29,12:06:00,12,6,5,Saturday,43,54.41941074523397,2,2
423,BHMBCCMKT01,577,26.14453614,91.73617216,339,car,high,8,0,29-10-2016,12:26:00,2016-10-29 12:26:00,2016-10-29,12:26:00,12,26,5,Saturday,43,58.752166377816295,3,3
424,BHMBCCMKT01,577,26.14453614,91.73617216,338,bike,average,6,0,29-10-2016,12:59:00,2016-10-29 12:59:00,2016-10-29,12:59:00,12,59,5,Saturday,43,58.578856152513005,2,2
425,BHMBCCMKT01,577,26.14453614,91.73617216,368,car,high,8,0,29-10-2016,13:26:00,2016-10-29 13:26:00,2016-10-29,13:26:00,13,26,5,Saturday,43,63.77816291161178,3,3
426,BHMBCCMKT01,577,26.14453614,91.73617216,366,bike,average,5,0,29-10-2016,13:59:00,2016-10-29 13:59:00,2016-10-29,13:59:00,13,59,5,Saturday,43,63.43154246100519,2,2
427,BHMBCCMKT01,577,26.14453614,91.73617216,374,car,average,4,0,29-10-2016,14:26:00,2016-10-29 14:26:00,2016-10-29,14:26:00,14,26,5,Saturday,43,64.81802426343154,3,2
428,BHMBCCMKT01,577,26.14453614,91.73617216,414,bike,average,4,0,29-10-2016,14:59:00,2016-10-29 14:59:00,2016-10-29,14:59:00,14,59,5,Saturday,43,71.75043327556327,2,2
429,BHMBCCMKT01,577,26.14453614,91.73617216,417,car,low,2,0,29-10-2016,15:26:00,2016-10-29 15:26:00,2016-10-29,15:26:00,15,26,5,Saturday,43,72.27036395147314,3,1
430,BHMBCCMKT01,577,26.14453614,91.73617216,417,cycle,average,3,0,29-10-2016,15:59:00,2016-10-29 15:59:00,2016-10-29,15:59:00,15,59,5,Saturday,43,72.27036395147314,1,2
431,BHMBCCMKT01,577,26.14453614,91.73617216,369,car,low,1,0,29-10-2016,16:26:00,2016-10-29 16:26:00,2016-10-29,16:26:00,16,26,5,Saturday,43,63.951473136915084,3,1
432,BHMBCCMKT01,577,26.14453614,91.73617216,43,car,average,2,1,30-10-2016,07:59:00,2016-10-30 07:59:00,2016-10-30,07:59:00,7,59,6,Sunday,43,7.452339688041594,3,2
433,BHMBCCMKT01,577,26.14453614,91.73617216,43,car,average,2,1,30-10-2016,07:59:00,2016-10-30 07:59:00,2016-10-30,07:59:00,7,59,6,Sunday,43,7.452339688041594,3,2
434,BHMBCCMKT01,577,26.14453614,91.73617216,43,car,low,2,1,30-10-2016,07:59:00,2016-10-30 07:59:00,2016-10-30,07:59:00,7,59,6,Sunday,43,7.452339688041594,3,1
435,BHMBCCMKT01,577,26.14453614,91.73617216,44,bike,low,2,1,30-10-2016,08:25:00,2016-10-30 08:25:00,2016-10-30,08:25:00,8,25,6,Sunday,43,7.625649913344887,2,1
436,BHMBCCMKT01,577,26.14453614,91.73617216,45,bike,low,2,1,30-10-2016,08:59:00,2016-10-30 08:59:00,2016-10-30,08:59:00,8,59,6,Sunday,43,7.798960138648179,2,1
437,BHMBCCMKT01,577,26.14453614,91.73617216,44,bike,low,2,1,30-10-2016,09:25:00,2016-10-30 09:25:00,2016-10-30,09:25:00,9,25,6,Sunday,43,7.625649913344887,2,1
438,BHMBCCMKT01,577,26.14453614,91.73617216,47,car,low,2,1,30-10-2016,09:59:00,2016-10-30 09:59:00,2016-10-30,09:59:00,9,59,6,Sunday,43,8.145580589254767,3,1
439,BHMBCCMKT01,577,26.14453614,91.73617216,61,car,low,3,1,30-10-2016,10:25:00,2016-10-30 10:25:00,2016-10-30,10:25:00,10,25,6,Sunday,43,10.571923743500866,3,1
440,BHMBCCMKT01,577,26.14453614,91.73617216,84,car,average,4,1,30-10-2016,10:59:00,2016-10-30 10:59:00,2016-10-30,10:59:00,10,59,6,Sunday,43,14.558058925476603,3,2
441,BHMBCCMKT01,577,26.14453614,91.73617216,107,cycle,average,6,1,30-10-2016,11:25:00,2016-10-30 11:25:00,2016-10-30,11:25:00,11,25,6,Sunday,43,18.544194107452338,1,2
442,BHMBCCMKT01,577,26.14453614,91.73617216,122,car,high,7,1,30-10-2016,11:59:00,2016-10-30 11:59:00,2016-10-30,11:59:00,11,59,6,Sunday,43,21.143847487001732,3,3
443,BHMBCCMKT01,577,26.14453614,91.73617216,142,truck,high,9,1,30-10-2016,12:26:00,2016-10-30 12:26:00,2016-10-30,12:26:00,12,26,6,Sunday,43,24.610051993067593,4,3
444,BHMBCCMKT01,577,26.14453614,91.73617216,169,car,high,8,1,30-10-2016,13:06:00,2016-10-30 13:06:00,2016-10-30,13:06:00,13,6,6,Sunday,43,29.289428076256502,3,3
445,BHMBCCMKT01,577,26.14453614,91.73617216,177,car,high,9,1,30-10-2016,13:25:00,2016-10-30 13:25:00,2016-10-30,13:25:00,13,25,6,Sunday,43,30.675909878682845,3,3
446,BHMBCCMKT01,577,26.14453614,91.73617216,182,car,average,6,1,30-10-2016,13:59:00,2016-10-30 13:59:00,2016-10-30,13:59:00,13,59,6,Sunday,43,31.542461005199307,3,2
447,BHMBCCMKT01,577,26.14453614,91.73617216,183,car,high,7,1,30-10-2016,14:32:00,2016-10-30 14:32:00,2016-10-30,14:32:00,14,32,6,Sunday,43,31.715771230502597,3,3
448,BHMBCCMKT01,577,26.14453614,91.73617216,157,bike,average,3,1,30-10-2016,15:00:00,2016-10-30 15:00:00,2016-10-30,15:00:00,15,0,6,Sunday,43,27.209705372616984,2,2
449,BHMBCCMKT01,577,26.14453614,91.73617216,147,car,average,3,1,30-10-2016,15:32:00,2016-10-30 15:32:00,2016-10-30,15:32:00,15,32,6,Sunday,43,25.476603119584055,3,2
450,BHMBCCMKT01,577,26.14453614,91.73617216,49,car,low,1,0,31-10-2016,08:00:00,2016-10-31 08:00:00,2016-10-31,08:00:00,8,0,0,Monday,44,8.492201039861353,3,1
451,BHMBCCMKT01,577,26.14453614,91.73617216,58,truck,low,2,0,31-10-2016,08:26:00,2016-10-31 08:26:00,2016-10-31,08:26:00,8,26,0,Monday,44,10.051993067590988,4,1
452,BHMBCCMKT01,577,26.14453614,91.73617216,67,cycle,low,1,0,31-10-2016,09:00:00,2016-10-31 09:00:00,2016-10-31,09:00:00,9,0,0,Monday,44,11.611785095320624,1,1
453,BHMBCCMKT01,577,26.14453614,91.73617216,92,car,average,2,0,31-10-2016,09:26:00,2016-10-31 09:26:00,2016-10-31,09:26:00,9,26,0,Monday,44,15.944540727902945,3,2
454,BHMBCCMKT01,577,26.14453614,91.73617216,111,car,low,2,0,31-10-2016,10:00:00,2016-10-31 10:00:00,2016-10-31,10:00:00,10,0,0,Monday,44,19.23743500866551,3,1
455,BHMBCCMKT01,577,26.14453614,91.73617216,129,car,average,3,0,31-10-2016,10:26:00,2016-10-31 10:26:00,2016-10-31,10:26:00,10,26,0,Monday,44,22.357019064124785,3,2
456,BHMBCCMKT01,577,26.14453614,91.73617216,166,car,average,4,0,31-10-2016,11:00:00,2016-10-31 11:00:00,2016-10-31,11:00:00,11,0,0,Monday,44,28.769497400346623,3,2
457,BHMBCCMKT01,577,26.14453614,91.73617216,178,cycle,average,4,0,31-10-2016,11:26:00,2016-10-31 11:26:00,2016-10-31,11:26:00,11,26,0,Monday,44,30.849220103986134,1,2
458,BHMBCCMKT01,577,26.14453614,91.73617216,198,truck,high,7,0,31-10-2016,12:00:00,2016-10-31 12:00:00,2016-10-31,12:00:00,12,0,0,Monday,44,34.31542461005199,4,3
459,BHMBCCMKT01,577,26.14453614,91.73617216,199,bike,high,7,0,31-10-2016,12:26:00,2016-10-31 12:26:00,2016-10-31,12:26:00,12,26,0,Monday,44,34.48873483535528,2,3
460,BHMBCCMKT01,577,26.14453614,91.73617216,198,cycle,high,7,0,31-10-2016,13:00:00,2016-10-31 13:00:00,2016-10-31,13:00:00,13,0,0,Monday,44,34.31542461005199,1,3
461,BHMBCCMKT01,577,26.14453614,91.73617216,201,bike,high,6,0,31-10-2016,13:26:00,2016-10-31 13:26:00,2016-10-31,13:26:00,13,26,0,Monday,44,34.835355285961874,2,3
462,BHMBCCMKT01,577,26.14453614,91.73617216,189,bike,average,4,0,31-10-2016,13:59:00,2016-10-31 13:59:00,2016-10-31,13:59:00,13,59,0,Monday,44,32.755632582322356,2,2
463,BHMBCCMKT01,577,26.14453614,91.73617216,185,car,average,4,0,31-10-2016,14:26:00,2016-10-31 14:26:00,2016-10-31,14:26:00,14,26,0,Monday,44,32.06239168110919,3,2
464,BHMBCCMKT01,577,26.14453614,91.73617216,160,car,average,2,0,31-10-2016,15:00:00,2016-10-31 15:00:00,2016-10-31,15:00:00,15,0,0,Monday,44,27.729636048526864,3,2
465,BHMBCCMKT01,577,26.14453614,91.73617216,141,car,low,2,0,31-10-2016,15:27:00,2016-10-31 15:27:00,2016-10-31,15:27:00,15,27,0,Monday,44,24.436741767764296,3,1
466,BHMBCCMKT01,577,26.14453614,91.73617216,130,cycle,low,2,0,31-10-2016,16:00:00,2016-10-31 16:00:00,2016-10-31,16:00:00,16,0,0,Monday,44,22.530329289428074,1,1
467,BHMBCCMKT01,577,26.14453614,91.73617216,121,car,low,2,0,31-10-2016,16:26:00,2016-10-31 16:26:00,2016-10-31,16:26:00,16,26,0,Monday,44,20.97053726169844,3,1
468,BHMBCCMKT01,577,26.14453614,91.73617216,50,car,low,1,0,01-11-2016,08:06:00,2016-11-01 08:06:00,2016-11-01,08:06:00,8,6,1,Tuesday,44,8.665511265164644,3,1
469,BHMBCCMKT01,577,26.14453614,91.73617216,54,car,low,1,0,01-11-2016,08:26:00,2016-11-01 08:26:00,2016-11-01,08:26:00,8,26,1,Tuesday,44,9.358752166377817,3,1
470,BHMBCCMKT01,577,26.14453614,91.73617216,69,car,average,2,0,01-11-2016,09:00:00,2016-11-01 09:00:00,2016-11-01,09:00:00,9,0,1,Tuesday,44,11.95840554592721,3,2
471,BHMBCCMKT01,577,26.14453614,91.73617216,91,car,low,1,0,01-11-2016,09:26:00,2016-11-01 09:26:00,2016-11-01,09:26:00,9,26,1,Tuesday,44,15.771230502599654,3,1
472,BHMBCCMKT01,577,26.14453614,91.73617216,135,truck,average,3,0,01-11-2016,10:00:00,2016-11-01 10:00:00,2016-11-01,10:00:00,10,0,1,Tuesday,44,23.39688041594454,4,2
473,BHMBCCMKT01,577,26.14453614,91.73617216,163,truck,average,4,0,01-11-2016,10:26:00,2016-11-01 10:26:00,2016-11-01,10:26:00,10,26,1,Tuesday,44,28.249566724436743,4,2
474,BHMBCCMKT01,577,26.14453614,91.73617216,185,car,average,5,0,01-11-2016,11:00:00,2016-11-01 11:00:00,2016-11-01,11:00:00,11,0,1,Tuesday,44,32.06239168110919,3,2
475,BHMBCCMKT01,577,26.14453614,91.73617216,207,bike,average,4,0,01-11-2016,11:26:00,2016-11-01 11:26:00,2016-11-01,11:26:00,11,26,1,Tuesday,44,35.875216637781634,2,2
476,BHMBCCMKT01,577,26.14453614,91.73617216,239,car,high,7,0,01-11-2016,12:00:00,2016-11-01 12:00:00,2016-11-01,12:00:00,12,0,1,Tuesday,44,41.421143847487,3,3
477,BHMBCCMKT01,577,26.14453614,91.73617216,244,car,high,7,0,01-11-2016,12:26:00,2016-11-01 12:26:00,2016-11-01,12:26:00,12,26,1,Tuesday,44,42.287694974003465,3,3
478,BHMBCCMKT01,577,26.14453614,91.73617216,243,car,high,8,0,01-11-2016,13:00:00,2016-11-01 13:00:00,2016-11-01,13:00:00,13,0,1,Tuesday,44,42.114384748700175,3,3
479,BHMBCCMKT01,577,26.14453614,91.73617216,241,car,high,7,0,01-11-2016,13:26:00,2016-11-01 13:26:00,2016-11-01,13:26:00,13,26,1,Tuesday,44,41.76776429809358,3,3
480,BHMBCCMKT01,577,26.14453614,91.73617216,229,car,average,4,0,01-11-2016,14:00:00,2016-11-01 14:00:00,2016-11-01,14:00:00,14,0,1,Tuesday,44,39.68804159445407,3,2
481,BHMBCCMKT01,577,26.14453614,91.73617216,199,truck,average,3,0,01-11-2016,14:26:00,2016-11-01 14:26:00,2016-11-01,14:26:00,14,26,1,Tuesday,44,34.48873483535528,4,2
482,BHMBCCMKT01,577,26.14453614,91.73617216,180,bike,average,2,0,01-11-2016,15:00:00,2016-11-01 15:00:00,2016-11-01,15:00:00,15,0,1,Tuesday,44,31.195840554592717,2,2
483,BHMBCCMKT01,577,26.14453614,91.73617216,167,bike,low,2,0,01-11-2016,15:27:00,2016-11-01 15:27:00,2016-11-01,15:27:00,15,27,1,Tuesday,44,28.942807625649912,2,1
484,BHMBCCMKT01,577,26.14453614,91.73617216,153,car,low,1,0,01-11-2016,16:00:00,2016-11-01 16:00:00,2016-11-01,16:00:00,16,0,1,Tuesday,44,26.51646447140381,3,1
485,BHMBCCMKT01,577,26.14453614,91.73617216,133,car,low,1,0,01-11-2016,16:33:00,2016-11-01 16:33:00,2016-11-01,16:33:00,16,33,1,Tuesday,44,23.050259965337954,3,1
486,BHMBCCMKT01,577,26.14453614,91.73617216,50,bike,low,1,0,02-11-2016,07:56:00,2016-11-02 07:56:00,2016-11-02,07:56:00,7,56,2,Wednesday,44,8.665511265164644,2,1
487,BHMBCCMKT01,577,26.14453614,91.73617216,52,car,low,1,0,02-11-2016,08:30:00,2016-11-02 08:30:00,2016-11-02,08:30:00,8,30,2,Wednesday,44,9.01213171577123,3,1
488,BHMBCCMKT01,577,26.14453614,91.73617216,57,car,low,2,0,02-11-2016,08:56:00,2016-11-02 08:56:00,2016-11-02,08:56:00,8,56,2,Wednesday,44,9.878682842287695,3,1
489,BHMBCCMKT01,577,26.14453614,91.73617216,81,car,average,2,0,02-11-2016,09:30:00,2016-11-02 09:30:00,2016-11-02,09:30:00,9,30,2,Wednesday,44,14.038128249566725,3,2
490,BHMBCCMKT01,577,26.14453614,91.73617216,97,car,average,2,0,02-11-2016,09:56:00,2016-11-02 09:56:00,2016-11-02,09:56:00,9,56,2,Wednesday,44,16.81109185441941,3,2
491,BHMBCCMKT01,577,26.14453614,91.73617216,125,car,low,3,0,02-11-2016,10:29:00,2016-11-02 10:29:00,2016-11-02,10:29:00,10,29,2,Wednesday,44,21.663778162911612,3,1
492,BHMBCCMKT01,577,26.14453614,91.73617216,144,car,average,3,0,02-11-2016,10:56:00,2016-11-02 10:56:00,2016-11-02,10:56:00,10,56,2,Wednesday,44,24.956672443674176,3,2
493,BHMBCCMKT01,577,26.14453614,91.73617216,167,car,average,4,0,02-11-2016,11:30:00,2016-11-02 11:30:00,2016-11-02,11:30:00,11,30,2,Wednesday,44,28.942807625649912,3,2
494,BHMBCCMKT01,577,26.14453614,91.73617216,169,bike,average,5,0,02-11-2016,11:56:00,2016-11-02 11:56:00,2016-11-02,11:56:00,11,56,2,Wednesday,44,29.289428076256502,2,2
495,BHMBCCMKT01,577,26.14453614,91.73617216,184,car,high,7,0,02-11-2016,12:30:00,2016-11-02 12:30:00,2016-11-02,12:30:00,12,30,2,Wednesday,44,31.88908145580589,3,3
496,BHMBCCMKT01,577,26.14453614,91.73617216,192,car,average,4,0,02-11-2016,13:03:00,2016-11-02 13:03:00,2016-11-02,13:03:00,13,3,2,Wednesday,44,33.27556325823224,3,2
497,BHMBCCMKT01,577,26.14453614,91.73617216,188,car,average,4,0,02-11-2016,13:30:00,2016-11-02 13:30:00,2016-11-02,13:30:00,13,30,2,Wednesday,44,32.582322357019066,3,2
498,BHMBCCMKT01,577,26.14453614,91.73617216,188,bike,average,3,0,02-11-2016,14:03:00,2016-11-02 14:03:00,2016-11-02,14:03:00,14,3,2,Wednesday,44,32.582322357019066,2,2
499,BHMBCCMKT01,577,26.14453614,91.73617216,171,car,average,3,0,02-11-2016,14:30:00,2016-11-02 14:30:00,2016-11-02,14:30:00,14,30,2,Wednesday,44,29.636048526863085,3,2
500,BHMBCCMKT01,577,26.14453614,91.73617216,153,car,average,4,0,02-11-2016,14:56:00,2016-11-02 14:56:00,2016-11-02,14:56:00,14,56,2,Wednesday,44,26.51646447140381,3,2
501,BHMBCCMKT01,577,26.14453614,91.73617216,130,bike,low,3,0,02-11-2016,15:29:00,2016-11-02 15:29:00,2016-11-02,15:29:00,15,29,2,Wednesday,44,22.530329289428074,2,1
502,BHMBCCMKT01,577,26.14453614,91.73617216,125,car,average,2,0,02-11-2016,16:03:00,2016-11-02 16:03:00,2016-11-02,16:03:00,16,3,2,Wednesday,44,21.663778162911612,3,2
503,BHMBCCMKT01,577,26.14453614,91.73617216,115,car,average,2,0,02-11-2016,16:30:00,2016-11-02 16:30:00,2016-11-02,16:30:00,16,30,2,Wednesday,44,19.930675909878683,3,2
504,BHMBCCMKT01,577,26.14453614,91.73617216,51,car,low,1,0,03-11-2016,08:00:00,2016-11-03 08:00:00,2016-11-03,08:00:00,8,0,3,Thursday,44,8.838821490467938,3,1
505,BHMBCCMKT01,577,26.14453614,91.73617216,56,car,low,1,0,03-11-2016,08:26:00,2016-11-03 08:26:00,2016-11-03,08:26:00,8,26,3,Thursday,44,9.705372616984402,3,1
506,BHMBCCMKT01,577,26.14453614,91.73617216,60,cycle,low,1,0,03-11-2016,09:00:00,2016-11-03 09:00:00,2016-11-03,09:00:00,9,0,3,Thursday,44,10.398613518197573,1,1
507,BHMBCCMKT01,577,26.14453614,91.73617216,80,car,low,1,0,03-11-2016,09:26:00,2016-11-03 09:26:00,2016-11-03,09:26:00,9,26,3,Thursday,44,13.864818024263432,3,1
508,BHMBCCMKT01,577,26.14453614,91.73617216,119,car,low,3,0,03-11-2016,10:00:00,2016-11-03 10:00:00,2016-11-03,10:00:00,10,0,3,Thursday,44,20.623916811091856,3,1
509,BHMBCCMKT01,577,26.14453614,91.73617216,138,car,low,2,0,03-11-2016,10:26:00,2016-11-03 10:26:00,2016-11-03,10:26:00,10,26,3,Thursday,44,23.91681109185442,3,1
510,BHMBCCMKT01,577,26.14453614,91.73617216,185,car,average,5,0,03-11-2016,11:00:00,2016-11-03 11:00:00,2016-11-03,11:00:00,11,0,3,Thursday,44,32.06239168110919,3,2
511,BHMBCCMKT01,577,26.14453614,91.73617216,195,car,high,6,0,03-11-2016,11:26:00,2016-11-03 11:26:00,2016-11-03,11:26:00,11,26,3,Thursday,44,33.795493934142115,3,3
512,BHMBCCMKT01,577,26.14453614,91.73617216,195,car,high,7,0,03-11-2016,12:00:00,2016-11-03 12:00:00,2016-11-03,12:00:00,12,0,3,Thursday,44,33.795493934142115,3,3
513,BHMBCCMKT01,577,26.14453614,91.73617216,191,truck,high,7,0,03-11-2016,12:26:00,2016-11-03 12:26:00,2016-11-03,12:26:00,12,26,3,Thursday,44,33.10225303292894,4,3
514,BHMBCCMKT01,577,26.14453614,91.73617216,196,truck,high,7,0,03-11-2016,12:59:00,2016-11-03 12:59:00,2016-11-03,12:59:00,12,59,3,Thursday,44,33.96880415944541,4,3
515,BHMBCCMKT01,577,26.14453614,91.73617216,191,truck,high,7,0,03-11-2016,13:26:00,2016-11-03 13:26:00,2016-11-03,13:26:00,13,26,3,Thursday,44,33.10225303292894,4,3
516,BHMBCCMKT01,577,26.14453614,91.73617216,187,car,average,5,0,03-11-2016,13:59:00,2016-11-03 13:59:00,2016-11-03,13:59:00,13,59,3,Thursday,44,32.40901213171577,3,2
517,BHMBCCMKT01,577,26.14453614,91.73617216,177,car,high,5,0,03-11-2016,14:26:00,2016-11-03 14:26:00,2016-11-03,14:26:00,14,26,3,Thursday,44,30.675909878682845,3,3
518,BHMBCCMKT01,577,26.14453614,91.73617216,154,car,average,3,0,03-11-2016,15:00:00,2016-11-03 15:00:00,2016-11-03,15:00:00,15,0,3,Thursday,44,26.689774696707108,3,2
519,BHMBCCMKT01,577,26.14453614,91.73617216,142,car,low,2,0,03-11-2016,15:26:00,2016-11-03 15:26:00,2016-11-03,15:26:00,15,26,3,Thursday,44,24.610051993067593,3,1
520,BHMBCCMKT01,577,26.14453614,91.73617216,120,car,low,1,0,03-11-2016,16:03:00,2016-11-03 16:03:00,2016-11-03,16:03:00,16,3,3,Thursday,44,20.797227036395146,3,1
521,BHMBCCMKT01,577,26.14453614,91.73617216,108,car,average,2,0,03-11-2016,16:30:00,2016-11-03 16:30:00,2016-11-03,16:30:00,16,30,3,Thursday,44,18.717504332755635,3,2
522,BHMBCCMKT01,577,26.14453614,91.73617216,48,bike,low,1,0,04-11-2016,08:00:00,2016-11-04 08:00:00,2016-11-04,08:00:00,8,0,4,Friday,44,8.31889081455806,2,1
523,BHMBCCMKT01,577,26.14453614,91.73617216,56,bike,low,1,0,04-11-2016,08:26:00,2016-11-04 08:26:00,2016-11-04,08:26:00,8,26,4,Friday,44,9.705372616984402,2,1
524,BHMBCCMKT01,577,26.14453614,91.73617216,71,bike,low,1,0,04-11-2016,08:59:00,2016-11-04 08:59:00,2016-11-04,08:59:00,8,59,4,Friday,44,12.305025996533796,2,1
525,BHMBCCMKT01,577,26.14453614,91.73617216,97,car,low,1,0,04-11-2016,09:33:00,2016-11-04 09:33:00,2016-11-04,09:33:00,9,33,4,Friday,44,16.81109185441941,3,1
526,BHMBCCMKT01,577,26.14453614,91.73617216,115,truck,low,2,0,04-11-2016,10:00:00,2016-11-04 10:00:00,2016-11-04,10:00:00,10,0,4,Friday,44,19.930675909878683,4,1
527,BHMBCCMKT01,577,26.14453614,91.73617216,135,car,average,3,0,04-11-2016,10:26:00,2016-11-04 10:26:00,2016-11-04,10:26:00,10,26,4,Friday,44,23.39688041594454,3,2
528,BHMBCCMKT01,577,26.14453614,91.73617216,154,bike,high,6,0,04-11-2016,11:00:00,2016-11-04 11:00:00,2016-11-04,11:00:00,11,0,4,Friday,44,26.689774696707108,2,3
529,BHMBCCMKT01,577,26.14453614,91.73617216,179,truck,high,6,0,04-11-2016,11:33:00,2016-11-04 11:33:00,2016-11-04,11:33:00,11,33,4,Friday,44,31.022530329289427,4,3
530,BHMBCCMKT01,577,26.14453614,91.73617216,183,car,high,7,0,04-11-2016,12:00:00,2016-11-04 12:00:00,2016-11-04,12:00:00,12,0,4,Friday,44,31.715771230502597,3,3
531,BHMBCCMKT01,577,26.14453614,91.73617216,182,car,high,6,0,04-11-2016,12:33:00,2016-11-04 12:33:00,2016-11-04,12:33:00,12,33,4,Friday,44,31.542461005199307,3,3
532,BHMBCCMKT01,577,26.14453614,91.73617216,171,car,high,6,0,04-11-2016,13:00:00,2016-11-04 13:00:00,2016-11-04,13:00:00,13,0,4,Friday,44,29.636048526863085,3,3
533,BHMBCCMKT01,577,26.14453614,91.73617216,173,car,high,6,0,04-11-2016,13:26:00,2016-11-04 13:26:00,2016-11-04,13:26:00,13,26,4,Friday,44,29.98266897746967,3,3
534,BHMBCCMKT01,577,26.14453614,91.73617216,179,car,average,4,0,04-11-2016,13:59:00,2016-11-04 13:59:00,2016-11-04,13:59:00,13,59,4,Friday,44,31.022530329289427,3,2
535,BHMBCCMKT01,577,26.14453614,91.73617216,167,car,average,3,0,04-11-2016,14:26:00,2016-11-04 14:26:00,2016-11-04,14:26:00,14,26,4,Friday,44,28.942807625649912,3,2
536,BHMBCCMKT01,577,26.14453614,91.73617216,156,car,average,2,0,04-11-2016,15:00:00,2016-11-04 15:00:00,2016-11-04,15:00:00,15,0,4,Friday,44,27.03639514731369,3,2
537,BHMBCCMKT01,577,26.14453614,91.73617216,145,bike,low,2,0,04-11-2016,15:26:00,2016-11-04 15:26:00,2016-11-04,15:26:00,15,26,4,Friday,44,25.12998266897747,2,1
538,BHMBCCMKT01,577,26.14453614,91.73617216,136,car,low,2,0,04-11-2016,16:00:00,2016-11-04 16:00:00,2016-11-04,16:00:00,16,0,4,Friday,44,23.570190641247834,3,1
539,BHMBCCMKT01,577,26.14453614,91.73617216,119,bike,low,1,0,04-11-2016,16:26:00,2016-11-04 16:26:00,2016-11-04,16:26:00,16,26,4,Friday,44,20.623916811091856,2,1
540,BHMBCCMKT01,577,26.14453614,91.73617216,43,car,average,2,0,05-11-2016,08:00:00,2016-11-05 08:00:00,2016-11-05,08:00:00,8,0,5,Saturday,44,7.452339688041594,3,2
541,BHMBCCMKT01,577,26.14453614,91.73617216,48,bike,low,1,0,05-11-2016,08:26:00,2016-11-05 08:26:00,2016-11-05,08:26:00,8,26,5,Saturday,44,8.31889081455806,2,1
542,BHMBCCMKT01,577,26.14453614,91.73617216,59,car,low,1,0,05-11-2016,08:59:00,2016-11-05 08:59:00,2016-11-05,08:59:00,8,59,5,Saturday,44,10.22530329289428,3,1
543,BHMBCCMKT01,577,26.14453614,91.73617216,90,car,low,2,0,05-11-2016,09:26:00,2016-11-05 09:26:00,2016-11-05,09:26:00,9,26,5,Saturday,44,15.597920277296359,3,1
544,BHMBCCMKT01,577,26.14453614,91.73617216,135,car,low,1,0,05-11-2016,09:59:00,2016-11-05 09:59:00,2016-11-05,09:59:00,9,59,5,Saturday,44,23.39688041594454,3,1
545,BHMBCCMKT01,577,26.14453614,91.73617216,181,car,average,3,0,05-11-2016,10:33:00,2016-11-05 10:33:00,2016-11-05,10:33:00,10,33,5,Saturday,44,31.369150779896017,3,2
546,BHMBCCMKT01,577,26.14453614,91.73617216,224,bike,average,4,0,05-11-2016,10:59:00,2016-11-05 10:59:00,2016-11-05,10:59:00,10,59,5,Saturday,44,38.82149046793761,2,2
547,BHMBCCMKT01,577,26.14453614,91.73617216,243,car,average,5,0,05-11-2016,11:26:00,2016-11-05 11:26:00,2016-11-05,11:26:00,11,26,5,Saturday,44,42.114384748700175,3,2
548,BHMBCCMKT01,577,26.14453614,91.73617216,278,car,high,8,0,05-11-2016,12:06:00,2016-11-05 12:06:00,2016-11-05,12:06:00,12,6,5,Saturday,44,48.18024263431543,3,3
549,BHMBCCMKT01,577,26.14453614,91.73617216,288,car,high,7,0,05-11-2016,12:26:00,2016-11-05 12:26:00,2016-11-05,12:26:00,12,26,5,Saturday,44,49.91334488734835,3,3
550,BHMBCCMKT01,577,26.14453614,91.73617216,331,bike,high,7,0,05-11-2016,13:00:00,2016-11-05 13:00:00,2016-11-05,13:00:00,13,0,5,Saturday,44,57.36568457538995,2,3
551,BHMBCCMKT01,577,26.14453614,91.73617216,351,car,high,7,0,05-11-2016,13:33:00,2016-11-05 13:33:00,2016-11-05,13:33:00,13,33,5,Saturday,44,60.831889081455806,3,3
552,BHMBCCMKT01,577,26.14453614,91.73617216,361,bike,average,5,0,05-11-2016,13:59:00,2016-11-05 13:59:00,2016-11-05,13:59:00,13,59,5,Saturday,44,62.56499133448874,2,2
553,BHMBCCMKT01,577,26.14453614,91.73617216,346,cycle,average,4,0,05-11-2016,14:26:00,2016-11-05 14:26:00,2016-11-05,14:26:00,14,26,5,Saturday,44,59.96533795493934,1,2
554,BHMBCCMKT01,577,26.14453614,91.73617216,369,car,average,3,0,05-11-2016,15:00:00,2016-11-05 15:00:00,2016-11-05,15:00:00,15,0,5,Saturday,44,63.951473136915084,3,2
555,BHMBCCMKT01,577,26.14453614,91.73617216,390,car,low,2,0,05-11-2016,15:26:00,2016-11-05 15:26:00,2016-11-05,15:26:00,15,26,5,Saturday,44,67.59098786828423,3,1
556,BHMBCCMKT01,577,26.14453614,91.73617216,368,car,average,2,0,05-11-2016,16:00:00,2016-11-05 16:00:00,2016-11-05,16:00:00,16,0,5,Saturday,44,63.77816291161178,3,2
557,BHMBCCMKT01,577,26.14453614,91.73617216,340,cycle,low,2,0,05-11-2016,16:26:00,2016-11-05 16:26:00,2016-11-05,16:26:00,16,26,5,Saturday,44,58.925476603119584,1,1
558,BHMBCCMKT01,577,26.14453614,91.73617216,35,cycle,low,2,1,06-11-2016,08:00:00,2016-11-06 08:00:00,2016-11-06,08:00:00,8,0,6,Sunday,44,6.065857885615252,1,1
559,BHMBCCMKT01,577,26.14453614,91.73617216,35,truck,low,1,1,06-11-2016,08:26:00,2016-11-06 08:26:00,2016-11-06,08:26:00,8,26,6,Sunday,44,6.065857885615252,4,1
560,BHMBCCMKT01,577,26.14453614,91.73617216,36,car,low,2,1,06-11-2016,09:00:00,2016-11-06 09:00:00,2016-11-06,09:00:00,9,0,6,Sunday,44,6.239168110918544,3,1
561,BHMBCCMKT01,577,26.14453614,91.73617216,39,car,low,3,1,06-11-2016,09:33:00,2016-11-06 09:33:00,2016-11-06,09:33:00,9,33,6,Sunday,44,6.759098786828423,3,1
562,BHMBCCMKT01,577,26.14453614,91.73617216,46,cycle,low,3,1,06-11-2016,10:00:00,2016-11-06 10:00:00,2016-11-06,10:00:00,10,0,6,Sunday,44,7.9722703639514725,1,1
563,BHMBCCMKT01,577,26.14453614,91.73617216,53,car,low,3,1,06-11-2016,10:26:00,2016-11-06 10:26:00,2016-11-06,10:26:00,10,26,6,Sunday,44,9.185441941074524,3,1
564,BHMBCCMKT01,577,26.14453614,91.73617216,77,truck,average,4,1,06-11-2016,10:59:00,2016-11-06 10:59:00,2016-11-06,10:59:00,10,59,6,Sunday,44,13.344887348353554,4,2
565,BHMBCCMKT01,577,26.14453614,91.73617216,96,car,average,5,1,06-11-2016,11:26:00,2016-11-06 11:26:00,2016-11-06,11:26:00,11,26,6,Sunday,44,16.63778162911612,3,2
566,BHMBCCMKT01,577,26.14453614,91.73617216,124,cycle,average,5,1,06-11-2016,11:59:00,2016-11-06 11:59:00,2016-11-06,11:59:00,11,59,6,Sunday,44,21.49046793760832,1,2
567,BHMBCCMKT01,577,26.14453614,91.73617216,153,car,high,9,1,06-11-2016,12:26:00,2016-11-06 12:26:00,2016-11-06,12:26:00,12,26,6,Sunday,44,26.51646447140381,3,3
568,BHMBCCMKT01,577,26.14453614,91.73617216,178,car,high,8,1,06-11-2016,13:06:00,2016-11-06 13:06:00,2016-11-06,13:06:00,13,6,6,Sunday,44,30.849220103986134,3,3
569,BHMBCCMKT01,577,26.14453614,91.73617216,188,car,high,9,1,06-11-2016,13:26:00,2016-11-06 13:26:00,2016-11-06,13:26:00,13,26,6,Sunday,44,32.582322357019066,3,3
570,BHMBCCMKT01,577,26.14453614,91.73617216,216,cycle,average,6,1,06-11-2016,13:59:00,2016-11-06 13:59:00,2016-11-06,13:59:00,13,59,6,Sunday,44,37.43500866551127,1,2
571,BHMBCCMKT01,577,26.14453614,91.73617216,225,car,high,8,1,06-11-2016,14:33:00,2016-11-06 14:33:00,2016-11-06,14:33:00,14,33,6,Sunday,44,38.9948006932409,3,3
572,BHMBCCMKT01,577,26.14453614,91.73617216,211,car,average,4,1,06-11-2016,15:00:00,2016-11-06 15:00:00,2016-11-06,15:00:00,15,0,6,Sunday,44,36.56845753899481,3,2
573,BHMBCCMKT01,577,26.14453614,91.73617216,188,bike,low,3,1,06-11-2016,15:26:00,2016-11-06 15:26:00,2016-11-06,15:26:00,15,26,6,Sunday,44,32.582322357019066,2,1
574,BHMBCCMKT01,577,26.14453614,91.73617216,163,car,low,3,1,06-11-2016,15:59:00,2016-11-06 15:59:00,2016-11-06,15:59:00,15,59,6,Sunday,44,28.249566724436743,3,1
575,BHMBCCMKT01,577,26.14453614,91.73617216,130,car,low,2,1,06-11-2016,16:26:00,2016-11-06 16:26:00,2016-11-06,16:26:00,16,26,6,Sunday,44,22.530329289428074,3,1
576,BHMBCCMKT01,577,26.14453614,91.73617216,30,car,low,1,0,07-11-2016,08:00:00,2016-11-07 08:00:00,2016-11-07,08:00:00,8,0,0,Monday,45,5.1993067590987865,3,1
577,BHMBCCMKT01,577,26.14453614,91.73617216,38,car,low,1,0,07-11-2016,08:26:00,2016-11-07 08:26:00,2016-11-07,08:26:00,8,26,0,Monday,45,6.5857885615251295,3,1
578,BHMBCCMKT01,577,26.14453614,91.73617216,49,car,low,1,0,07-11-2016,08:59:00,2016-11-07 08:59:00,2016-11-07,08:59:00,8,59,0,Monday,45,8.492201039861353,3,1
579,BHMBCCMKT01,577,26.14453614,91.73617216,61,car,low,2,0,07-11-2016,09:26:00,2016-11-07 09:26:00,2016-11-07,09:26:00,9,26,0,Monday,45,10.571923743500866,3,1
580,BHMBCCMKT01,577,26.14453614,91.73617216,87,truck,low,2,0,07-11-2016,09:59:00,2016-11-07 09:59:00,2016-11-07,09:59:00,9,59,0,Monday,45,15.077989601386482,4,1
581,BHMBCCMKT01,577,26.14453614,91.73617216,110,car,low,2,0,07-11-2016,10:26:00,2016-11-07 10:26:00,2016-11-07,10:26:00,10,26,0,Monday,45,19.064124783362217,3,1
582,BHMBCCMKT01,577,26.14453614,91.73617216,142,car,high,5,0,07-11-2016,10:59:00,2016-11-07 10:59:00,2016-11-07,10:59:00,10,59,0,Monday,45,24.610051993067593,3,3
583,BHMBCCMKT01,577,26.14453614,91.73617216,157,car,high,7,0,07-11-2016,11:26:00,2016-11-07 11:26:00,2016-11-07,11:26:00,11,26,0,Monday,45,27.209705372616984,3,3
584,BHMBCCMKT01,577,26.14453614,91.73617216,157,bike,average,4,0,07-11-2016,11:59:00,2016-11-07 11:59:00,2016-11-07,11:59:00,11,59,0,Monday,45,27.209705372616984,2,2
585,BHMBCCMKT01,577,26.14453614,91.73617216,160,car,average,5,0,07-11-2016,12:26:00,2016-11-07 12:26:00,2016-11-07,12:26:00,12,26,0,Monday,45,27.729636048526864,3,2
586,BHMBCCMKT01,577,26.14453614,91.73617216,154,car,high,6,0,07-11-2016,12:59:00,2016-11-07 12:59:00,2016-11-07,12:59:00,12,59,0,Monday,45,26.689774696707108,3,3
587,BHMBCCMKT01,577,26.14453614,91.73617216,161,car,high,6,0,07-11-2016,13:33:00,2016-11-07 13:33:00,2016-11-07,13:33:00,13,33,0,Monday,45,27.902946273830153,3,3
588,BHMBCCMKT01,577,26.14453614,91.73617216,162,car,average,5,0,07-11-2016,13:59:00,2016-11-07 13:59:00,2016-11-07,13:59:00,13,59,0,Monday,45,28.07625649913345,3,2
589,BHMBCCMKT01,577,26.14453614,91.73617216,156,bike,average,3,0,07-11-2016,14:33:00,2016-11-07 14:33:00,2016-11-07,14:33:00,14,33,0,Monday,45,27.03639514731369,2,2
590,BHMBCCMKT01,577,26.14453614,91.73617216,148,car,average,3,0,07-11-2016,15:00:00,2016-11-07 15:00:00,2016-11-07,15:00:00,15,0,0,Monday,45,25.64991334488735,3,2
591,BHMBCCMKT01,577,26.14453614,91.73617216,124,car,low,2,0,07-11-2016,15:33:00,2016-11-07 15:33:00,2016-11-07,15:33:00,15,33,0,Monday,45,21.49046793760832,3,1
592,BHMBCCMKT01,577,26.14453614,91.73617216,119,car,average,2,0,07-11-2016,16:00:00,2016-11-07 16:00:00,2016-11-07,16:00:00,16,0,0,Monday,45,20.623916811091856,3,2
593,BHMBCCMKT01,577,26.14453614,91.73617216,118,cycle,low,2,0,07-11-2016,16:33:00,2016-11-07 16:33:00,2016-11-07,16:33:00,16,33,0,Monday,45,20.45060658578856,1,1
594,BHMBCCMKT01,577,26.14453614,91.73617216,34,car,low,1,0,08-11-2016,07:59:00,2016-11-08 07:59:00,2016-11-08,07:59:00,7,59,1,Tuesday,45,5.892547660311958,3,1
595,BHMBCCMKT01,577,26.14453614,91.73617216,36,car,low,1,0,08-11-2016,08:26:00,2016-11-08 08:26:00,2016-11-08,08:26:00,8,26,1,Tuesday,45,6.239168110918544,3,1
596,BHMBCCMKT01,577,26.14453614,91.73617216,46,car,low,1,0,08-11-2016,08:59:00,2016-11-08 08:59:00,2016-11-08,08:59:00,8,59,1,Tuesday,45,7.9722703639514725,3,1
597,BHMBCCMKT01,577,26.14453614,91.73617216,68,cycle,average,2,0,08-11-2016,09:26:00,2016-11-08 09:26:00,2016-11-08,09:26:00,9,26,1,Tuesday,45,11.785095320623917,1,2
598,BHMBCCMKT01,577,26.14453614,91.73617216,112,car,low,2,0,08-11-2016,09:59:00,2016-11-08 09:59:00,2016-11-08,09:59:00,9,59,1,Tuesday,45,19.410745233968804,3,1
599,BHMBCCMKT01,577,26.14453614,91.73617216,150,car,average,3,0,08-11-2016,10:33:00,2016-11-08 10:33:00,2016-11-08,10:33:00,10,33,1,Tuesday,45,25.99653379549394,3,2
600,BHMBCCMKT01,577,26.14453614,91.73617216,178,bike,average,5,0,08-11-2016,11:00:00,2016-11-08 11:00:00,2016-11-08,11:00:00,11,0,1,Tuesday,45,30.849220103986134,2,2
601,BHMBCCMKT01,577,26.14453614,91.73617216,196,car,average,4,0,08-11-2016,11:33:00,2016-11-08 11:33:00,2016-11-08,11:33:00,11,33,1,Tuesday,45,33.96880415944541,3,2
602,BHMBCCMKT01,577,26.14453614,91.73617216,236,car,average,5,0,08-11-2016,11:59:00,2016-11-08 11:59:00,2016-11-08,11:59:00,11,59,1,Tuesday,45,40.90121317157712,3,2
603,BHMBCCMKT01,577,26.14453614,91.73617216,250,cycle,high,8,0,08-11-2016,12:27:00,2016-11-08 12:27:00,2016-11-08,12:27:00,12,27,1,Tuesday,45,43.327556325823224,1,3
604,BHMBCCMKT01,577,26.14453614,91.73617216,253,car,high,7,0,08-11-2016,13:00:00,2016-11-08 13:00:00,2016-11-08,13:00:00,13,0,1,Tuesday,45,43.84748700173311,3,3
605,BHMBCCMKT01,577,26.14453614,91.73617216,237,bike,high,7,0,08-11-2016,13:34:00,2016-11-08 13:34:00,2016-11-08,13:34:00,13,34,1,Tuesday,45,41.074523396880416,2,3
606,BHMBCCMKT01,577,26.14453614,91.73617216,223,bike,average,3,0,08-11-2016,14:00:00,2016-11-08 14:00:00,2016-11-08,14:00:00,14,0,1,Tuesday,45,38.64818024263432,2,2
607,BHMBCCMKT01,577,26.14453614,91.73617216,196,cycle,average,3,0,08-11-2016,14:26:00,2016-11-08 14:26:00,2016-11-08,14:26:00,14,26,1,Tuesday,45,33.96880415944541,1,2
